"2","HC",26,"Wenn man etwas erl. Muss sich einen Assistenten nehmen kann ohne unaufmerksam zu werden. ","Da ich so etwas nicht kannte. Alles ungewohnt und man muss erst ein Gefühl dafür bekommen. Anfangs Etwas mulmig ob tatsächlich sicher Wim automatisierte Fahren. War sehr stark auf das Bediniungsfeld fixiert achtesonst mehr auf die Strecke. ","Vlt.  mehr akustische Signale da man dadurch nicht zu viel auf die Anzeigen schaut. Anzeigen konnten etwas länger bleiben. ","Interessante Erfahrung die ich positiv empfinde. ","Find ich gut um unterschiedliche Eindrücke mit einbringen zu können. Gut gemacht. ","",1000,0,"",0,"","","",23,0,"",0,"Dachte Auto wäre in automatisierten fahren","","Angezeigt dass im automatisierten fahren",1000,3,"",3,"","","Drücken der Tasten nicht ganz klar ","Umschalten in automatisiert",1000,3,"",3,"","Jetzt auch Füße vom Gas gelassen, Einschätzung bei Fahrt vorhin (tc2) war falsch ","Hände ans Lenkrad,  kein Gas geben",1000,2,"",2,"","Auto lenkt eher nach rechts, ich fahre immer eher mittig oder links ","","","",2,2,"",2,"","Am Anfang nicht direkt richtig, kurz verschaltet, könnte aber schnell korrigieren. Allgemein schaue ich wesentlich mehr aufs Display ","",1000,2,"",2,"","","",23,2,"",2,"","Unsicher ob Hände wegnehmen , Meldung dass automatisiert Verfügbar kam genau dann als ich Hände entfernt habe, also eher doch dran lassen","Umschalten in andere stufen",1000,3,"",3,"","","Vom ausführen her nein, habe aber falsch auf Ansage reagiert ","","Systemübersteuerung",0,0,"",0,"Erst bei Ton reagiert ","","","",23,3,"",3,"","Schaue aufgrund der vorherigen Fahrt öfter auf Display,  kann ja sein dass ich eingreifen muss","","Zu manuell übernehmen ","",0,0,"",0,"Auf Anzeige hin fast zum stehen gekommen ","Gab es einen Countdown?  Wenn ja dann übersehen. Bei Rot erschrocken und abgebremst, hätte wahrscheinlich direkt weiter fahren sollen",""
"2","HC",27,"","","","","","",1000,0,"",0,"","","",23,0,"",0,"Bei Anzeige kurz geschaut ob automatisiert fährt","","Spur selber gehalten",1000,3,"",2,"Nur in l2 gefahren,  ohne Hände am Lenkrad,  HOD Meldung ignoriert, erst auf VL Aufforderung übernommenen ","","","Weder Gas geben  noch lenken nötig",1000,3,"",3,"","","Bin manuell gefahren ",1000,2,"",0,"Bei Aufforderung in manuell geschaltet,  dann auch dem Fehler bewusst, trotzdem nicht korrigiert,  weil ""Strecke war dann zu kurz"" . Hinweis von VL, dass bis zum Schluss gehandelt werden soll/darf","","","Lenkt wieder zurück in spur","",2,2,"",2,"","Muss Augen auf der Straße lassen, was wenn Gegenstände auf Straße auftauchen ","",1000,2,"",2,"","","Hände nicht mehr an Lenkrad ",23,2,"",3,"Schaltet unaufgefordert in l3","","Nicht mehr Hände ans Lenkrad ",1000,3,"",3,"Frage mit hände: im assistierten fahren nein, obwohl oben automatisierten gesagt,habe den Eindruck  dass P die Stufen durcheinander bringt","","","Musste manuell fahren","Systemfehler",0,0,"",0,"","","","Spurgaltung und tempomat ",23,3,"",2,"Fährt in l2 obwohl Ansage für l3","","","","",0,0,"",0,"Hatte Sensorfehler eigentlich schon erwähnt,  Frage trotzdem mit nein beantwortet,  keine Ahnung warum er bei 1 automatisiert nennt","",""
"2","HC",28,"Nur zwei Bedienelemente, um zwischen den Level zu wechseln. Nicht überladen. Klar und strukturiert. ","Icons nicht mittig. Kein einheitliches farbschema zwischen Text und icon der unterschiedlichen Level. ","Design anpassen. Mit auditiven Feedback arbeiten. ","","","Lenkrad mit 2 Händen nicht mehr durchgestrichen ",1000,0,"",0,"","","",23,0,"",0,"","Macht keinen Sinn was ich bei erster Fahrt gesagt habe, manuell ist immer verfügbar ","",1000,3,"",3,"","","","",1000,3,"",3,"Bei Wiederherstellung kurz verschaltet ","","",1000,2,"",2,"","Verwirrung, was passiert wenn ich auf Pfeil drücke? Vorher musste ich zwei mal abdrücken (von manuell in automatisierten) einmal anschalten, und 2 mal Pfeile, jetzt nur noch einmal pfeil","","","",2,2,"",2,"P testet Hände von Lenkrad zu entfernen,  auf HOD wieder an Lenkrad genommen","","",1000,2,"",2,"","","",23,2,"",2,"","","",1000,3,"",3,"","","","","",0,0,"",0,"","Warnten hat gefehlt , hätte ich leicht übersehen. Bin über bremse in manuell, geht das auch mit Knopf? Icon von assistiert nicht in der Mitte, stört mich, sollte symmetrisch sein. Wenn ich zwischen Stufen Wechsel gibt es farbige Icons, Schrift ist aber weiß, nicht so auffällig,  würde besser passen wenn Schrift in gleicher farbe","","",23,3,"",3,"","Kein auditiver Feedback dass Level verfügbar,  kann man beim fahren Leicht übersehen, ist in die Richtung aber nicht so schlimm wie in andere, könnte auch zu viel werden","","","",0,0,"",0,"","Würde ich vorher schon aufgefordert bevor es Rot wurde? Wahrscheinlich erst einmal gelb",""
"2","HC",29,"Bedienung, allerdings switch zu manuellem fahren durchaus verwirrend beim ersten mal","Hatte mir gewünscht immer klar zu sehen welche Modi zur Verfügung stehen bspw durch farblich markierte icons","Haptische Warnung, bspw vibrieren, ","","Sehr interessante Studie und ich habe gerne mitgemacht","",1000,0,"",0,"","","Assistenzsysteme verfügbar ",23,0,"",0,"","","",1000,3,"",3,"","Komisches Gefühl nicht auf Straße zu schauen","","",1000,3,"",3,"","","",1000,2,"",2,"","","","","",2,2,"",2,"Sieht Skala wohl nicht","Zwar gesehen, aber etwas schwächer hinweiß der auftaucht und wieder verschwindet , würde mir dauerhafte Anzeige wünsche in welchem ich gerade bin+welche noch verfügbar sind, sodass ich den Status immer sehe","",1000,2,"",2,"","","",23,2,"",2,"","Hinweis kam länger,  sehe jetzt die Icons unten,  zeigen mir Verfügbarkeit an, sollte aber präsenter sein","",1000,3,"",3,"","","","","",0,0,"",0,"","Leuchten am Lenkrad gesehen, akustische Signal gewünscht ","Wollte erst per Umschalten Taste in manuell schalten, hätte aber direkt aus Taste drücken müssen","",23,3,"",3,"Golf stand unten, hat P angemerkt, evtl leichte Ablenkung ","","","","Systemfehler",0,0,"",0,"","Ton und rote LEDs,  Aufmerksamkeit direkt bei Fahrzeug, überlegt was systemfehler heißen soll, dadurch kurz abgelenkt",""
"2","HC",30,"Alles","Nichts","Akustische unterstützen muss sein","Nein","Nein, dankeschön ","Hände ans Lenkrad ",1000,0,"",2,"","","",23,0,"",0,"","","Hände ans Lenkrad ",1000,3,"",2,"Nur in l2 obwohl Ansage für automatisiert ","","","",1000,3,"",3,"","Geht er in manuell zurück sobald ich bremse trete? Nebenaufgabe aktuell nicht erlaubt, ","",1000,2,"",2,"Kurze Schwierigkeiten bei L3 reset. P nimmt mehrmals Abbildung mit automationleceln zur hilfe","","","Musste in manuell gehen","",2,2,"",0,"","","",1000,2,"",2,"","","",23,2,"",2,"","","Kann in automatisiert schalten",1000,3,"",3,"","","","Umschalten von automatisiert in manuell ","System hat es nicht mehr vorgegeben",0,0,"",0,"","Ton gewünscht ","","Kann in automatisiert wechseln ",23,3,"",3,"","","","Von automatisiert in manuell ","",0,0,"",0,"","Konnte Grund nicht lesen, da erst auf nebenaufgabe konzentriert und dann übernommen",""
"2","HC",31,"Was neues ausprobieren","Ablenkung durch Tabletne","Nein","War interessant","Unterschied zum assistierten fahren besser vorher erklaeren","",1000,0,"",0,"","","",23,0,"",0,"","","",1000,3,"",3,"Traut sich noch nicht so ganz die Hände weg zu nehmen ","","","",1000,3,"",3,"","","",1000,2,"",2,"Anfangs einmal aus versehen deaktiviert,  VL musste erneut auffordern ","","Hätte erwartet dass mit Wechsel Taste alle drei durchgemacht hat, vielleicht war ich auch nur zu langsam weil er in manuell das Gas weg nimmt","","",2,2,"",2,"","","",1000,2,"",2,"","","",23,2,"",2,"","","",1000,3,"",3,"","Darf ich die Hände bei assistiert wirklich nicht wegnehmen? Versuche die bildr zu interpretieren,  bei assistiert sind die Hände nicht ganz dran, aber was heißt das?","Hätte wahrscheinlich nur rechten nehmen müssen, dachte ich muss erst mit linker Taste aktivieren, das war dann aber ausschalten ","","System ? ",0,0,"",0,"P hat surt nicht bedient","Spielen vergessen, weil automation so interessant. Beim spielen hätte ich bestimmt die meldung übersehen","","Beide verfügbar ",23,3,"",3,"","","","","",0,0,"",0,"","",""
"2","LC",73,"Es war eine ganz neue Erfahrung und leicht zu bedienen","Etwas unsicher gefühlt, weil es ungewohnt war","Keine","","Super interessant und innovativ, sowie sinnvoll","",1000,0,"",0,"","","",23,0,"",0,"","","",1000,3,"",2,"","Wollte direkt hochschalten und habe noch nicht an gemacht, hat nicht funktioniert ","Wusste nicht genau was was ist  daher nur eine Stufe hochgestellt","",1000,3,"",3,"","","",1000,2,"",2,"","","","","",2,2,"",2,"","","",1000,2,"",2,"","","",23,2,"",2,"","","",1000,3,"",3,"","","","In manuell wechseln ","",0,0,"",0,"","","","",23,3,"",3,"","","","Soll übernehmen und danach kam Aufforderung zur notbremsung ","Evtl systemfehler",0,0,"",0,"","Wusste nicht genau ob übernehmen sie jetzt bedeutet dass ich Automation ausschalten soll oder einfach nur Hände an Lenkrad nehmen",""
"2","LC",74,"","","","","","",1000,0,"",0,"","","Lenkrad fester",23,0,"",2,"P drückt Wechsel Taste, nichts passiert,  denkt aber ist in automatisierten fahren und spielt surt , Eingriff von vl","","",1000,3,"",2,"","","Wusste nicht was ich mit den Tasten machen muss, vielleicht Informationen was ich drücken kann durch aufleuchten der Tasten oder Info auf display","Lenkrad war anders",1000,3,"",3,"","","Lenkrad ",1000,2,"",2,"Sagt nein, spielt aber trotzdem surt","","","Lenkrad stabiler","",2,2,"",2,"Spielt immer noch surt","","Lenkrad ",1000,2,"",2,"","","Lenkrad ",23,2,"",2,"Spielt immer noch surt","","Lenkrad ",1000,3,"",3,"","","","Lenkrad ","",0,0,"",0,"Anzeige lange ignoriert und nicht gelesen, obwohl Kopf immer mal hin bewegt (im eyetracker prüfen), bei Notbremsung dann Vollbremsung ","","","Lenkrad ",23,3,"",3,"Spielt surt in l0","","","Lenkrad ","",0,0,"",0,"Nachfrage VL warum immer surt bedient: P sagt es ist automatismus wenn es da hängt, so wie bei handy","",""
"2","HC",32,"Entlastung bei Funktion","Spurabweichung, Konsequenzen ein Nichtfunktion","Nein","FEHLERQUOTE  ","Zuverlässigkeit? Einsatztauglich bei welchen Geschwindigkeiten? Reaktionszeiten? usw. ","",1000,0,"",0,"","","",23,0,"",0,"","","",1000,3,"",3,"","","","",1000,3,"",3,"","","",1000,2,"",2,"","","","","",2,2,"",2,"","","",1000,2,"",2,"","","",23,2,"",2,"","","",1000,3,"",3,"","","","Assistiert nicht mehr verfügbar ","",0,0,"",0,"P ist nur in l2 gefahren,  Meldung kam trotzdem ","","","",23,3,"",3,"Hinweis und erklärung von vl","Sind von Spur abgekommen, musste nach Steuern, kann mich nicht ganz drauf verlassen, vielleicht etwas falsch eingestellt?","","Von automatisiert in manuell ","",0,0,"",0,"","",""
"2","LC",75,"Unterschiede in den Farben","Sehr koventionell","Nein","Unsicher in welchem Modus man sich befindet","","",1000,0,"",0,"","Sehr beschäftigt damit ins Display zu schauen","Anzeige automatisiertes fahren",23,0,"",0,"P ist unsicher was Anzeige bedeutet, denkt erst Auto wäre jetzt automatisiert ","Sehr unsicher, würde die Anzeige länger aufleuchten wenn automatisiert verfügbar? ","Anzeige erst blau und dann gelb",1000,3,"",3,"","Traue mich noch nicht Nebentätigkeit zu machen","Nicht sicher in welcher Stufe ich tatsächlich gelandet bin ","Anzeige Farbe",1000,3,"",3,"","Immer noch unsicher ob in automatisierter stufe, blaue und Gelbe Stufe nicht eindeutig,  mir würde Ansage oder ähnliches fehlen","Farbliche Anzeige ändert",1000,2,"Teilautomatisiert",2,"","","Immer noch nicht sicher welche die richtige stufe","Farben verändert","",2,2,"Teilautomatisiert",2,"","","Farbe",1000,2,"Teilautomatisiert",2,"","Bin so mit herausfinden des richtigen Level beschäftigt,  dass ich gefahr im Verkehr wäre","Farbe",23,2,"Teilautomatisiert",2,"P schaltet hin und her um herauszufinden welches Level was ist","","Farbliche Anzeige ",1000,3,"",3,"","","","Anzeige verschwindet ","",0,0,"",0,"P sieht Anzeige nicht, Aufforderung zur Übernahme durch vl als nicht auf Notbremsung reagiert ","","","Gelbe Anzeige ",23,3,"",3,"","","","Anzeigen farbe","",0,0,"",0,"Wieder keine Reaktion auf Anzeigen,  Aufforderung von  vl","",""
"2","HC",33,"Die lesbarkeit","","","","","",1000,0,"",0,"","","",23,0,"",0,"","","Auto alleine gefahren ",1000,3,"",2,"","","","Rotes Licht Hände an Lenkrad ",1000,3,"",2,"","","Ansage",1000,2,"",2,"","Keine Probleme, musste aber kurz nachdenken, alles neu und automationsstufe schwer zu merken","","Assistiert nicht verfügbar ","",2,2,"",2,"","","",1000,2,"",2,"","","",23,2,"",2,"Hinweis VL, dass P Fehler korrigieren darf","","Von assistiert in automatisiert",1000,3,"",3,"","","","In manuell wechseln ","",0,0,"",0,"","","","",23,3,"",3,"P plötzlich unsicher mit automationsstufe und beantwortet Frage falsch, hält blau für automatisiert ","","","Manuell fahren","",0,0,"",0,"P sagt oben automatisierten,  geht aber im Verlauf der Fragen wahrscheinlich von manuell aus","",""
"2","LC",76,"Die gesamte Erfahrung war sehr erfrischend ","","Mit dem visuellen Reiz von begin an ein akustisches Signal kombinieren. ","","Gefällt mir sehr gut. Hatte das Gefühl in kompetenten Händen zu sein. ","",1000,0,"",0,"","","",23,0,"",0,"","","",1000,3,"",3,"","","","",1000,3,"",3,"","","",1000,2,"",2,"Nicht sicher bei Frage mit händen","","","","Sensorprobleme",2,2,"",2,"","","",1000,2,"",2,"","Gefühl ich werde müde weil ich mich weniger aufs fahren konzentrieren muss","",23,2,"",2,"","","",1000,3,"",3,"","","","","Systemwechsel",0,0,"",0,"","","","",23,3,"",3,"","","","","",0,0,"",0,"","War das richtig, dass ich gebremst habe?",""
"2","HC",34,"Schnelle erlernung der Bedienung und Funktionsweise, simple display Gestaltung, ","Alarm und zwischenmeldungen könnten ablenken oder zunächst verwirren ","Sprachassistent (verbale steuerung) ","","","",1000,0,"",0,"","","",23,0,"",0,"","Gefühl ich muss weniger Kontrolle übernehmen ","",1000,3,"",3,"","","","",1000,3,"",3,"","","",1000,2,"",2,"","Sobald ich mich mit Tablet beschäftige fahre ich 10 kmh mehr und muss oft korrigieren , ich denke wenn ich mich weniger konzentriere kontrolliere ich Fuß auf Gas weniger","Mir war nicht klar, dass ich nur Wechsel Taste drücken musste, habe zuerst aus gedrückt ","","",2,2,"",2,"","","",1000,2,"",2,"","","",23,2,"",2,"Spielt die ganze Zeit surt","Gefühlt am Anfang wahrgenommen dass etwas schief gefahren, dann noch korrigiert,  am Ende hat das Auto gefühlt gar nicht mehr mitgelenkt","",1000,3,"",3,"","Deutlicher unterschied zwischen fahrmodi, Fahrzeug reagiert ganz anders. Denke in automatisierten merke ich sofort dass das Auto viel ruhiger , wie auf Schienen fährt, deshalb besseres Gefühl etwas auf Tablet zu tun","","In manuell wechseln ","",0,0,"",0,"","","Anfangs schwer ersichtlich wie ich in manuell komme, dachte ich kann einfach durchwechseln","Assistenz verfügbar ",23,3,"",3,"","","","","",0,0,"",0,"","Keine Verfügbarkeit aber Aufforderung: Steuer sofort übernehmen,  Sensorfehler ",""
"2","HC",35,"Klare Trennung Dr Stufen durch symbole","Zu lange textbloecke bei Fehlermeldungen oder uebernahmeaufforderungen","Text reduzieren, multimodale Ansprache des Fahrers","","","",1000,0,"",0,"","","",23,0,"",0,"","","",1000,3,"",3,"","","","",1000,3,"",3,"P gibt  Gas in automatisierten fahren","","",1000,2,"",2,"","","","","",2,2,"",2,"","","",1000,2,"",2,"","","",23,2,"",2,"","","",1000,3,"",3,"","","","Bitte übernehmen ","",0,0,"",0,"","Musste hinschauen, ohne ton schwierig,  hätte ich auch übersehen können","","",23,3,"",3,"","","","Sofort übernehmen ","",0,0,"",0,"","",""
"2","LC",77,"Einfacher Wechsel zwischen Fahrstufen. Sichere Steuerung im assistierten und automatisierten Fahren. ","Unübersichtlich und still, wenn der Fahrer die Steuerung übernehmen soll. ","Auffälliger, wenn neuen Fahrstufen verfügbar/ nicht mehr verfügbar sind und wenn der Fahrer übernehmen soll. ","Hat spaß gemacht :) ","Sehr gute Begleitung während den Versuchen. ","",1000,0,"",0,"","","",23,0,"",0,"","","",1000,3,"",2,"","","","",1000,3,"",2,"","","",1000,2,"",2,"","Probleme mit Begriffen, deshalb am Anfang immer im falschen Level und hier auch nicht geschaltet","","","",2,2,"",2,"","","",1000,2,"",2,"O merkt bei Verfügbarkeit Frage an, dass automatisiert nicht verfügbar,  Änderung sei aber nicht während fahrt gewesen","","",23,2,"",2,"","","",1000,3,"",3,"","","","","System irgendwas",0,0,"",0,"","","","",23,3,"",3,"","","","","",0,0,"",0,"","",""
"2","LC",78,"Anzeige, Beim Fahren sehr unterstützend","Die Umschaltung zwischen den Fahrstufen","Jeder Modus mit separaten Schalter aktivierbar","Tolles Unterstützungssystem","Toll","",1000,0,"",0,"","","",23,0,"",0,"P denkt ist in automatisierten fahren und spielt surt ","","Geschwindigkeit und Spurhaltung",1000,3,"",2,"","","Ungewohnt die Kontrolle über Fahrzeug nicht zu haben","Anzeige bllau",1000,3,"",2,"","","Farbwechsel",1000,2,"",3,"","","","","",2,2,"",3,"","","Farbwechsel",1000,2,"",3,"","","Anzeigen und Spurgaltung wechseln",23,2,"",2,"","","Anzeigen , Lenkung,  spurhaltung",1000,3,"",3,"","","","Spurhaltung","",0,0,"",0,"","","","",23,3,"",3,"","","","","",0,0,"",2,"","",""
"2","LC",79,"Einfach Handhabung","Habe die unterschiedliche Stufen nicht genau erkenne können. Hätte mir vorher jemand erklären müssen. ","Bessere Erkennung in welcher Stufe ich mich befinde. ","Nein","Keine","",1000,0,"",0,"","Wenn sich etwas geändert hat, dann habe ich nichts bemerkt","",23,0,"",0,"P testet mit Händen von Lenkrad ob Auto automatisiert fährt ","","In Spur geblieben ",1000,3,"Assistenten",0,"P fährt manuell ohne Hände, VL greift kurz vor Ende der Fahrt ein, da Auto von Spur abzukommen droht","","","Steuer nicht mehr so fest in Hand halten",1000,3,"",2,"P sehr unsicher was automationsstufe angeht, Hände von l entfernt, Hinweis von VL um notbremsung zu vermeiden","","",1000,2,"",3,"","","Merke den unterschied nicht, wollte jetzt erstmal gucken ob das Auto wirklich in der Spur bleibt","Musste nicht mehr so viel lenken","",2,2,"",2,"Wieder hände von steuer, hod Meldung und eingriff von vl","Nachfrage was im assistiert gemacht werden muss. Erklärung vl, system überwachen","",1000,2,"",2,"Große Schwierigkeiten bei Beantwortung der 1. Frage","Von gefühl her automatisiert, kann es nicht genau sagen, musste ich wegen Geschwindigkeit hände an steuer tun? Blau und gelb in Anzeige, weiß aber nicht was was ist. Vom Gefühl her würde ich sagen gelb ist assistiert u blau automatisiert ","Farbe",23,2,"",3,"","","Lenkrad steuert",1000,3,"Kann ich nicht sagen",2,"Verwirrung warum h an l wenn Auto selber lenkt, geht davon aus dass Auto nur in automatisiert selber lenkt","Warum werden die Sachen so unmerklich gemacht, Stufe muss klar verständlich sein, ist für mich gar nicht nachvollziehbar. Dachte immer ich finde es über Fahrverhalten raus. Kein Problem mit Wechsel an sich, sondern mit Unterscheidung der stufen","","Hände von steuer","",0,0,"",3,"Keinerlei Reaktion auf Anzeige ","","","Hände vom steuer",23,3,"",3,"","","","Lenkrad hat gelenkt","",0,0,"",3,"Keinerlei Reaktion auf Anzeige,  Aufforderung zur Übernahme durch VL, da nur Hände ans Lenkrad genommen","","Drücken nicht, merke den unterschied immer noch nicht"
"2","HC",36,"Ja, ea war eine interessante Erfahrung.","Es war soweit in Ordnung, die Geschwindigkeit hätte höher sein können. ","Mehr Kurven und Hindernisse wären in dieser Testreihe interessant. ","Nein","Ich finde die Studie sehr gut, vielleicht irgendwann mit mehr Hindernissen und Kurven. ","",1000,0,"",0,"","","",23,0,"",0,"","","Tempomat und Spurassistenf",1000,3,"",2,"","","","Tempo und lenkung",1000,3,"",2,"","","",1000,2,"",3,"","","","Fahrzeug übernimmt kontrolle","",2,2,"",2,"","","",1000,2,"",2,"","Bin jetzt erst ein bisschen drauf gekommen ","",23,2,"",2,"P dachte bei verfügbarkeitsänderung dass Fahrzeug jetzt in automatisierten fahren ist","Erst im assistierten, dann ist das automatisierte gekommen","",1000,3,"",3,"","","","Musste wieder alles selber machen","",0,0,"",0,"","","","Spur und Geschwindigkeit von Auto übernommen",23,3,"",3,"","","","Selbst fahren müssen","Aufforderung durch ton",0,0,"",0,"","",""
"2","HC",37,"Lichtsignale und töne","","","","","",1000,0,"Normales fahren",0,"","","",23,0,"Normal ",0,"","Habe mich nicht getraut Tablet zu bedienen ","Spurhaltung",1000,3,"",2,"","","Wusste nicht was ich drücken muss, wusste nicht welche Taste assistiert und welche automatisiert,  da steht zweimal aut","",1000,3,"",3,"","Mir fällt es schwer mich auf Tablet zu konzentrieren,  habe das Gefühl ich muss auf Straße schauen. Tu mich etwas schwer mit automatisiert und assistiert (mit Begriffen und Einstellungen)","",1000,2,"",2,"","","","","",2,2,"",2,"","Unsicher ob nebenaufgabe machen soll oder nicht","",1000,2,"",2,"","","",23,2,"",2,"","","",1000,3,"",3,"","","","Muss übernehmen ","",0,0,"",0,"","","","Beides verfügbar ",23,3,"",3,"","","","","",0,0,"",0,"","",""
"2","LC",80,"Erst mal nichts neues","Nicht klar bei Assistent. Welches eingeschaltet ist   und warum überhaupt zwei systeme","Einschaltknopf nicht erforderlich.   Nur ein System ","Verwirrend. Die zwei systeme","Kurvenfahrt vermisst.        Höheregeschwindikeit.    Mehr lenkbewegungen eingriffe","",1000,0,"",0,"","","",23,0,"",0,"P spielt surt und droht von Straße abzukommen, ","Dachte er hat automatisiertes fahren aktiviert, weil das Display das gesagt hat. ","",1000,3,"",0,"","Habe gedrückt, automatisiert würde aber nicht aktiviert. Gemerkt weil Auto langsamer geworden. Wäre gut wenn man einen Hinweis bekommt (z.b. grünes licht) sobald Assistenz aktiviert, vermisse Vibrationen am Lenkrad ","","",1000,3,"",0,"","Ganz normal gefahren,  ohne assistenz. Ich bin es ja gewohnt automatisiert zu fahren, hier merkt man gar nichts am Lenkrad.  Vielleicht drücke ich den falschen Knopf, vielleicht muss ich erst einschalten. Bin es von Mercedes anders gewöhnt. Warum muss ich erst einschalten wenn ich auch direkt automatisiert fahren könnte? Finde ich überflüssig ","Spur gehalten",1000,2,"Vollautomatisch ",2,"P sagt während der Fahrt, dass das Auto in die Spur zurück lenkt und deshalb im automatisierten sein müsste (WaR aber assistiert )","War nicht sicher welche Stufe ich hatte, das könnte ich nicht unterscheiden. System sollte mir klar machen was was ist","","","",2,2,"",0,"P hat Hände nicht am Lenkrad,  hod zeigt notbremsung,  p bremst runter . Tc wird manuell zu Ende gefahren ","Unsicher in welcher stufe ich mich befinde. Sollte klar kommuniziert werden und was ich nebenbei machen darf. Könnte auch auf Handy oder Tablet dann angezeigt werden","Geschwindigkeit und Spurghaltung ",1000,2,"",3,"","Immernoch unsicher in welcher stufe","",23,2,"",0,"Verstehe seine Aussage nicht. HOD überdeckt verfügbarkeitsmeldung. P bremst ab und bleibt stehen bei Notbremsung.  Tc wird manuell zuende gefahren ","System ist trotz Lenkrad Eingriff im automatisierten fahren ... Bin gewohnt dass das System neu startet wenn ich eingreife. War überrascht dass das Auto weitergefahren ist als ich in Lenkrad eingegriffen  habe","",1000,3,"Vollassistiert",0,"P spielt immer surt, dieht hod nie, scheint nicht zu verstehen wann jände ans steuer müssen. Bleibt immer stehen wenn das Auto notbremsung anzeigt","Mehr mit Tönen arbeiten  damit ich was merke wenn ich abgelenkt bin","Erkennte Unterschied zwischen stufen nicht","Hat anfangs bei einschalten nicht gelenkt","",0,0,"Vollautomatisch ",0,"Meldung überdeckt HOD, nur Ton  zu hören, daraufhin bremst p","","","",23,3,"",0,"Wieder HOD notbremsung,  manuell zu Ende gefahren ","","Nicht erkennbar , ist System ein oder aus, immer unsicher","Reagiert bei einschalten ","",0,0,"",0,"","","Erkenne immer noch nicht welches System aktiviert "
"2","HC",38,"Die gewohnte steuerung","Eher die Unklarheit am Anfang, diese hatsichaber schnell gelegt","Ich denke die Funktionalität passt bereits und würde für den test angepasst","Nein","Nein passt","",1000,0,"",0,"","","",23,0,"",0,"","","",1000,3,"",2,"","Unterschied zwischen automatisiert und assistiert war für mich noch nicht ganz eindeutig. Weiß auch nicht ob ich Meldung gesehen hätte wenn ich sehr abgelenkt bin (Hod)","","",1000,3,"",2,"P hat wohl verständnisprobleme mit dem Begriff   , habe nachgefragt,  verstehe ihre Aussage aber nicht so ganz","","Hätte auch in automatisiert schalten können",1000,2,"",2,"","","Hatte Probleme mit begrifflichkeiten, erst jetzt ist klar geworden, dass ich schon vorher eine Stufe weiter schalten sollte","","",2,2,"",2,"","","",1000,2,"",2,"","","",23,2,"",2,"","","",1000,3,"",3,"","","","","",0,0,"",0,"","Habe es aus augenwinkel gesehen, würde mir aber zusätzlichen sound wünschen ","","",23,3,"",3,"","","","","",0,0,"",0,"","","Unterbewusste reaktion war ganz leicht zu bremsen, damit ging es aber nicht weg, deshalb knopf gedrückt "
"2","LC",81,"Eigentlich unauffällig integriert aber nicht versteckt","Die Warnhinweise (Notbremsung) sind meiner Meinung nach zu unauffällig ","GEFAHRENHINWEISE vielleicht etwas auffälliger anzeigen","","Nein","",1000,0,"",0,"","","",23,0,"",0,"","","",1000,3,"",2,"","Hätte Verfügbarkeit prominenter erwartet und nicht so klein auf der rechten seite ","","",1000,3,"Level 3",3,"P beschreibt skala für Verfügbarkeit korrekt","","",1000,2,"",2,"","","","","Sensordefekt",2,2,"",2,"","","",1000,2,"",2,"","","",23,2,"",2,"","","",1000,3,"",3,"","","","","",0,0,"",0,"Hat die Anzeige gesehen, hat nicht reagiert weil auf Ansage gewartet","Hinweis sehr leicht zu verpassen, weil nur visuell und nicht akustisch. Notbremsung aufforderung da muss man ja sofort reagieren ","","",23,3,"",3,"","","","","",0,0,"",0,"Farbfehlsichtigkeit?","Notbremsung nur gelb dargestellt, in rot gewünscht, oder mit rotem Hintergrund ",""
