"2","LC",82,"","Signalisierungen viel deutlicher","","","","",1000,0,"",0,"","","",23,0,"",0,"","","",1000,3,"",3,"","Muss je schlenker fahren um automation zu testen","","",1000,3,"",3,"","","",1000,2,"",0,"P bremst unaufgefordert um zu testen, tc manuell zu Ende gefahren","Wusste nicht, dass System ausschaltet wenn ich bremse . Komisch, dass das Bremsen die Stufe beendet, und komisch dass es keinen merklichen unterschied zwischen assistiert und automatisiert gibt","","","",2,2,"Zweite",2,"Hod notbremsung,  Aufforderung von vl","","",1000,2,"",0,"Automation durch lenken Übersteuert","","",23,2,"",0,"","","",1000,3,"",0,"Bremst und beendet die Automation unaufgefordert,  tc manuell zu Ende gefahren ","","","","",0,0,"",0,"","Systemgrenze,  übernehmen Sie. Was bedeutet das? Finde ich unlogisch. Wenn das Display so eine notbremsung anzeigt, ist das eine Katastrophe,  kann viel zu leicht übersehen werden , akustische Meldung fehlt ","","",23,3,"",3,"","","Finde es blöd das System einzuschalten und dann zu wechseln. Bei drei Stufen reicht doch ein Knopf für Stufe 0, assistiert und automatisiert ","","",0,0,"",0,"","",""
"3","HC",1,"The symbols were quite clear and the system gave me ample time to react to warnings and such.","It was sometimes unclear how to get back into manual driving mode","Maybe separate the button that allows for switching the automation levels up and down, it could be confusing to know if i was currently going up in automation levels or if i was going down","I really liked the flashing lights and signal warning, they were quite clear. This was also the first time I ever drove an automated car, so the experience was quite new and I did not fully trust the system at the beginning","I really enjoyed the study and it quite fun to drive what felt like a super futuristic car! Only thing I would change is the tightness on the eye tracker.",NA,1000,0,"",0,"","","Ass or wut available",23,0,"",2,"","","",1000,3,"",3,"Car irritating","","","",1000,3,"",3,"","","",1000,2,"",2,"","","","","",2,2,"",2,"Takes hands to steering wheel after hod","","",1000,2,"",2,"","","",23,2,"",2,"","I think I need to keep hands close to steering wheel in case sth goes wrong","",1000,3,"",3,"","","","","Limitation ahead",0,0,"",0,"","","Slightly unsure how to get back to manual driving","",23,3,"",3,"","",NA,"","",0,0,"",0,"","",""
"3","LC",51,"After a few try´s, I felt the HMI was extremly reliable. The HMI made the driving experience more comfortable.","I felt the HMI was not intuitive and a comfort level needed to be reached into order to be familiar with the controls. ","I would like to have a stronger notification system of HMI changes and warnings. ","Overall a good experience and I would use the HMI on a regular basis when driving. Once I understood how the system worked I would come to rely on it. ","An enjoayable study. One thing I would like to add is the definition between ''Automated'' and ''Assisted'' driving is still not clear. Deike was a wonderful instructor!",NA,1000,0,"Far left \\ automated?",0,"","I would not feel comfortable while driving automated, Id still be knowing that Im in control","",23,0,"",0,"","Secondary activities are very distracting","",1000,3,"Full automated",2,"","Hesitant at first. I felt the need to monitor the system","","",1000,3,"Fully automatic and cc",2,"","The more I get used to the car, I get more comfortable I get with letting the car drive
Feel guilty about giving the responsibility away","Hod",1000,2,"",3,"","Dont know difference between assisted and automated ; Only Started to feel comfortable after a while","Did not know which button to press, not intuitive","","",2,2,"",3,"","Assis5 driving, I dont understand what it does. Did not feel need to have foot on accelerator","",1000,2,"",3,"","Used to using it, starting to trust it.i dont follow my responsibility,feel guilty","",23,2,"",3,"","Feel more comfortable with secondary activities. Im not ashamed of this I trust it more, I dont look at speed anymore","",1000,3,"",2,"","Dont know difference between assisted and automated
I guess, automated lets me take off my hands, while assisted is mix of manual and automated","Still not intuitively confident with operating the buttons. Becomes easier","","",0,0,"Fully automatic",0,"","After I braked I needed to familiarize myself with how to get back to automated. Took me a while to see and register emergency brake","","",23,3,"Automatic",2,"","Way more comfortable with automated driving with doing secondary activities compared to manual driving",NA,"","",0,0,"Fully automatic",2,"","Fully confident that car can drive itself",""
"3","HC",2,"It was very easy to use, intuitive, and easy to learn. There was not an abundance of options, which made it simple to use on the go.","Sometimes it was hard to tell when I switched to automated driving that the car was in control. It might be helpful to have a physical indication (aside from just the display) that the car was driving autonomously.","See above. Otherwise it was great.","Nothing more than indicated above or my comments in the car. BMW has a great Navigation interaface vs. their competitors, and I think the design should not drift too far from that.","",NA,1000,0,"",0,"","","",23,0,"",0,"","Manual Icon Loks Like a waning ","",1000,3,"",3,"","I dont know whether bigger icon is the active level or the suggested level; slowed me down to 30kmh, felt little bit like an error","Had to guess which button to use","",1000,3,"Err",3,"Err","","",1000,2,"",2,"","Intuitive: tried to directly activate l3, but like this way better","","","Sensor not available",2,2,"",2,"","Icon on right confused me","",1000,2,"",2,"","Anticipated changes in availabilities coming from top","",23,2,"",2,"","","",1000,3,"",3,"","Didnt feel that the car is taking over when switching between manual and assisted, only display informs me","","","System overloaded\full",0,0,"",0,"","","","",23,3,"",3,"","Nothing except for display says the status is okay, on a straight I dont feel the car driving",NA,"","",0,0,"",0,"","",""
"3","LC",52,"Although the symbol for the assisted driving did not make much sense, it was easy to figure out as it was the middle symbol between the 3 which purose it served. Easy to figure out, intuitave, easy to switch between modes and the displays were easy on the eyes/nice to look at. ","I did not like that there was no sound associated with needing to suddenly switch from automated back to manuel. When something goes wrong in the car, like a sensor or system error, there should be noise/alarm or at the very lease vibration in the steering wheel to notify the driver's attention. If in automated the goal is for the driver to be able to realistically check emails, then they would not be looking constantly at the dashboard for a message to pop up saying that there could be an error and you need to switch back to manual. This feature made no sense to me and seems dangerous, therefore I would not trust using the automated system.","As stated above, there should be a sound or alarm when the driver would need to switch out of automated system to either assisted or manual. Especially is there is a sensor error or emergency braking is needed!","It was a little unclear which exact features were included in the assisted system. Intuitively I could feel that it controls acceleration, and at first I thought it took over the steering because I felt an immediate sensation in the steering wheel when I switched to assisted. However, I learned when the message appeared that I needed to keep my hands on the wheel. I wonder still what the other features of assisted driving would be, since I did not partake in switching lanes or anything other than driving straight.","Straightforward, easy and enjoyable experience, aside from the eye mask gave me a headache and began hurting and becoming really uncomfortable the last 15 minutes or so of the driving portion. The person assisting me in the experience was very friendly and helpful and made the experience pleasant for me!",NA,1000,0,"",0,"","","",23,0,"",0,"","","",1000,3,"",3,"","Took wrong level in the beginning, but no problem after hod","","",1000,3,"",3,"","","",1000,2,"",2,"","","","","",2,2,"",2,""," Not sure what Exactly the assisted driving features are, ","",1000,2,"",2,"","","",23,2,"",2,"","","",1000,3,"",3,"","","","","System failure",0,0,"",0,""," No noise, I was distracted ,could be dangerous","","",23,3,"",3,"","Noticed no notification,but the icons are now illuminated",NA,"","",0,0,"",0,"","",""
"3","LC",53,"it is very easy to use, I don`t have to learn so much","I can´t find anything, that was not good. ","A seperate button for assistant driving and one button for automatic driving would be good. ","The human-machine-interface I used was good. And I like the different colours between the different modes. The system was also easy to handle without a lot of instructions. ","The study and also the assistant driving was very interesting and I find the HMI is a very good thing. I would like to need it at every driving with my car. ",NA,1000,0,"",0,"","","Full automated and second",23,0,"",0,"","","",1000,3,"",3,"","","","",1000,3,"",3,"","","",1000,2,"",2,"","Removing hands is difficult,because I only drive assisted","","","",2,2,"",2,"","","",1000,2,"",2,"","","",23,2,"",2,"","","",1000,3,"",3,"","","","","",0,0,"",0,"","","","",23,3,"",3,"","",NA,"","Emergency brake",0,0,"",0,"","",""
"3","LC",54,"Quick response to setting the modes, and clarity about which mode I am in was very good. The steering feedback that pushes against small human inputs reminds me that it is working and helps build trust.","I would need more time with the system to develop more trust of it. If it were fitted to my car, and I had several weeks or months to get used to it, I think I would start to use it more often. ","The warning when losing support of automated features needs to be more clear. Especially when one is doing the secondary task, it is very easy to miss all of the warnings indicating that the functionality is going away.","A haptic and auditory feedback is necessary to notice the changes in availability, otherwise it is very easy to miss all of the warnings until the system turns itself off","Looking forward to see how it would impact the future of BMW cars!",NA,1000,0,"",0,"Hat L2 & l3 activated, ","","",23,0,"",0,"","","",1000,3,"",3,"","","Took a while to notice how to switch from assisted to automated","",1000,3,"",3,"","Strange to focus on surt, not trusting yet","",1000,2,"",2,"","","","","S.b",2,2,"",2,"Abgeworfen von auto wegen Regen kurz vor marker","","",1000,2,"",2,"","Starting to feel more comfortable with assisted","",23,2,"",2,"Abgeworfen wegen Regen kurz vor marker","","",1000,3,"",3,"","Learned that the system does actually steer and maintains speed","","","",0,0,"",0,"Not taken over even though he has seen it and as he said understood it","Noticing was problematic","","",23,3,"",3,"","Sceptically looking at display waiting for a warning, that didnt happen before",NA,"","",0,0,"",0,"","Little awkward that throttle was suddenly turned off
Took the warning seriously this time",""
"3","HC",3,"Everything was easy to use","I liked everything","Not at the moment","No","No, everything went well",NA,1000,0,"",0,"","","",23,0,"",0,"","","",1000,3,"",3,"","","","",1000,3,"",3,"","","",1000,2,"",2,"","Keep hands on steering wheel in assisted, I know that now","","Didnt read that part","",2,2,"",2,"","","",1000,2,"",2,"Distracted by car on track!","","",23,2,"",3,"","","",1000,3,"",3,"Break because of cars on road","","","","Not sure",0,0,"",0,"Eingreifen","","","",23,3,"",3,"","Understand that you can only activate automated via assisted",NA,"","Emergency brake",0,0,"",3,"Very late take over, Reading difficulties","",""
"3","HC",4,"The lights on the steering wheel were a nice touch and not very aggressive. The voice/sound was also good for taking me out of my concentration when I was playing the game.","Nothing really","Maybe have the entire interior light up slightly instead of just the steering wheel. If I were to do something that was making me not look anywhere near the steering wheel, having the entire car light up would make sure I got the message.","The more I used the automatic driving, the more it felt cumbersome to keep my fingers on the steering wheel in assisted mode, even though its quite relaxed by allowing me to only slightly touch the steering wheel. At the beginning I felt slightly distrustful of the automatic driving and assistance but that went away fairly quickly. I think I would take some time though before trusting it with other cars and people around.","Cool study. I hope that we can have fully automatic cars at some point, I hate driving long distances!",NA,1000,0,"0",0,"","","",23,0,"0",0,"","","",1000,3,"Automatic",3,"","","","",1000,3,"2, automated driving",3,"","","",1000,2,"",2,"","","Accidentally clicked on power button, I could have pressed the other button
Yellow flashing was good, caught my eye","","",2,2,"",2,"","Thinks hands close to wheel are enough","",1000,2,"",2,"","I know now I need hand on steering wheel while assisted","",23,2,"",2,"","Slightly hands on seems to be enough, which is nice","",1000,3,"",3,"","","","","Error ahead",0,0,"",0,"","","","",23,3,"",3,"","",NA,"","",0,0,"",0,"","The more I see errors, the less Im trusting, I started looking at the road ahead more, noise was good",""
"3","HC",5,"Well integrated into the usual car controls","Two buttons instead of one.
I expected to be able to click through all modes with one button instead of activiting the system with one button and changing the mode with another.
Uncertainty about what would happen if I did not follow the system`s instructions, in other words what would happen if I did not take back manual control","Turn on and cycle through driving modes with one button
More audio tones to indicate changing availability of driving modes
Information about what will happen if the systems instructions are not followed, eg ""Car will drive to the right and break to a compete stop""","","",NA,1000,0,"",0,"","","Assisted and fully automated",23,0,"Fully automated",3,"","","",1000,3,"Fully automated",3,"","","Slight problems, seemed not intuitive that I needed two buttons","",1000,3,"Fully automated",3,"","","",1000,2,"",2,"","","","Fully automated driving no longer available","",2,2,"",2,"","","",1000,2,"",2,"","","",23,2,"",2,"","","",1000,3,"",3,"","","","Fully automated no longer available","",0,0,"",0,"","I would expect a sound from the car when its important","","",23,3,"",3,"","",NA,"","",0,0,"",0,"","",""
"3","HC",8,"<it was interesting and something new. <i have used assitance before but not automation.","<i think it comes down to age. <i felt too nervouse to really engage in other activities during driving but after a while did not mind trying other things during the automated driving","<i felt the buttons were counterintuitive. <why not just have one for automation and one for assited instead of a power on and change in driving levels","<it is interesting and it is amazing what we are developing in new vehicles. <<<<<<<<<makes me nervous, however, that people might put too much faith in automation and not pa attention to the road","",NA,1000,0,"",0,"","","",23,0,"",2,"","","",1000,3,"",2,"","What is the difference between assisted and automated? It told me to put hands on steering wheel, Im curious to experience the system more","","",1000,3,"",3,"","Huge difference in the way the steering wheel felt between assisted and automated. It was a lot smoother and I instantly trusted it more. Assisted had more shakes","",1000,2,"",2,"","I dont pay attention to the display. I dont know whether I like assisted, steering feels weird and it distracts","","","",2,2,"",2,"","I could take away one hand, I could engage only halfway and check the car too","",1000,2,"",2,"","","",23,2,"",2,"","","",1000,3,"Automatic",3,"","Its easy to switch,but I feel like there should be one button for assisted and one for automated","","","System overload",0,0,"",0,"","Very clear display","","",23,3,"Automatic",3,"","I had the notification that they were not available, still I could activate them. I assumed it was a computer error. Since I could activate them, I guessed it was only a display error",NA,"Take over now","Sensor something",0,0,"Automatic",3,"","I didnt switch,I just held on to the wheel. I guess I should have switched; the notification was not clear: should I switch or just take hands on steering wheel? Didnt think",""
"3","LC",64,"Easy to use after an inital learning period.","The three symbols for the driving modes looked very similar, but their placement let me know which was which - manual on the left and fully automated on the right.  
When the Emergency Brake! command appeared on screen, there was no corresponding alarm or audible warning.
Some notifications on the display console might have been missed if I hadn´t been looking at the screen at the time.","Different symbols on the steering wheel for the Assisted and Automated driving modes, though I don´t have a suggestion.  I learned that the left button turned on the Assisted mode and that it had to be on before you could activate the second button for Automated mode.
Notifications on the screen could be in a different color, or flash, or something to make them more noticeable.  
","Designers should always remember that many middle aged and older drivers use reading glasses but don´t always wear them when they are driving, so don´t make symbols too small or similar.","",NA,1000,0,"",0,"","","",23,0,"",0,"","","3 icons lit up",1000,3,"",3,"","I hit the wrong one first that took me to semi automated","","Icons lit up",1000,3,"",3,"","Had troubles, because I didnt know that I couldnt just go directly to automated","",1000,2,"",2,"","","","","",2,2,"",2,"","It maintained speed, I start to learn what assisted means","",1000,2,"",2,"","","",23,2,"",2,"","","",1000,3,"",3,"","","","","After emergency brake icons no longer lit",0,0,"",0,"","","","",23,3,"",3,"","",NA,"","",0,0,"",0,"Zufällig hingeschaut","I happened to see it",""
"3","LC",55,"I liked how easy it was to toggle between the modes of automatic driving.","I wasnt sure how much i could trust the machine or if I could really perform other tasks while in fully automatic mode.","The commands that the machine gives the human should be more alarming","I didnt really notice a difference in the assisted driving and the fully automatic driving","I wasnt sure if i would be abel to perform tasks (such as emails) while the automated driving feature was on, if I were driving in traffic, instead of a straight road with out hazards.  I think the subject should be made to take turns or drive around cones to better expirence the difference in the three levels of automatic driving.",NA,1000,0,"First automated",0,"","","",23,0,"First automated",0,"","","I could toggle between manual and assisted driving",1000,3,"Fully automatic driving",2,"","","","",1000,3,"",0,"","","",1000,2,"Different assisted level",3,"","","","","",2,2,"",2,"","Saw The hod just now","",1000,2,"",2,"","","",23,2,"",2,"","","",1000,3,"Fully automatic driving",3,"","","","No lka or cc","",0,0,"",0,"","Dont know what system limit means","","",23,3,"Third, last",3,"","",NA,"","",0,0,"",2,"","",""
"3","HC",6,"I very much enjoyed the automatic driving mode experience! It made being in the car much more pleasant and worthwhile of my time. Assistance is also helpful but I preder automatic every time.","I did not like having to look at the screen between all three modes, especially in automatic. For manual and assisted, it is tolerable but for automatic, having to constantly check for warnings or errors made it slightly stressful/unpleasant. I also did not like the absence of audio assistance when changes occurred in modes, either verbal instructions or noise notifications would be helpful.","There is room for minor improvements, such as: 
- audio notification when modes become available/unavailable 
- less aggressive sound when there is an error. It made me very alarmed whereas specific verbal instructions would be more helpful and less stressful (i.e., human voice saying: there is an error. please turn off automatic driving and turn on manual). 
- I greatly prefer being able to use one button to control all modes and one button for only turning on and off. 
","","A verz pleasant and fun experience :)",NA,1000,0,"",0,"","","",23,0,"",2,"","","",1000,3,"",3,"","I like that braking deactivates the system","","",1000,3,"",3,"","","",1000,2,"",2,"","","Tiny bit, I tended to automatically press the power button","Assisted no longer available","",2,2,"",0,"","Wish I had a sound","",1000,2,"",2,"","Button is not intuitive, because it says aut","",23,2,"",2,"","I dont understand the point of assisted, only little helpful to release foot","",1000,3,"",3,"","","","","Some Error?",0,0,"",0,"","I would like to have a sound","","",23,3,"",3,"","",NA,"","",0,0,"",0,"","","I put my body into driving position,then I noticed that I needed to take over by pressing a button"
"3","HC",9,"<the interface was quick and straightforward","it was a little bland. Commparing to Tesla, a lot of similar information is displayed in more attractive ways","displaying the modes and the bottom is space efficient but was difficult to see at times. adding additional visual indicators to the car illustration in the center of the display would be nice. This may also be biased by my previous experience with tesla because thats how they show autopilot availability-","im excited to see this feature in production","",NA,1000,0,"0, original,non-automated",0,"","","",23,0,"0",0,"","","",1000,3,"2 , automated",3,"","Easier than I thought it would be (display)","","",1000,3,"",3,"","","",1000,2,"",2,"","","","","",2,2,"",2,"","","Greyed out at the bottom",1000,2,"",2,"","Easier to miss when there was no message at the top","",23,2,"",2,"","","",1000,3,"",3,"","","","It said switch to manual","System not available or sth like that",0,0,"",0,"","I expected a beep","","",23,3,"",3,"","",NA,"","System error?",0,0,"",0,"","Tone was a little sharp, made me hit the brake. a little softer one May have been okay too",""
"3","HC",10,"I like the variety of features it offers, however at the beginning it can be confusing to use. I was always confused with the names, especially Assisted and Automated, it took me a while to differentiate the two names. ","I was not very confident in leaving my hands from the wheel, that is because it is something new to me. Also whenever there was an alert, it was a visual message on the dashboard which makes it hard to read if one is not paying attention to the dashboard. ","Based on personal experience I would suggest a better visual design, that stands more, simpler to see and whenever there is an alert, there should always be a sound so the driver knows to look at the dashboard. ","I liked it, it is definitely something I would like to have in the future. Most importantly I think this is something that an individual should be trained on by an expert before using it, to avoid accidents. ","I found it great, definitely something new for me, I would definitely like this feature on my future vehicle, however this should be a feautre that is somehow people are well trained before using it. Thanks!",NA,1000,0,"",0,"","","",23,0,"Regular, left",0,"","","Automated available Message and green coloured text saying I should turn it on",1000,3,"",2,"Fragt, ob es Touch ist","","I didnt know how to turn it on","Two lanes in green",1000,3,"",2,"","","",1000,2,"",3,"Focuses on icons","Felt uncomfortable to take hands away","","","System error",2,2,"",2,"","I had to pay attention to display","",1000,2,"",2,"","","",23,2,"",2,"","""why did the sign popup when I was already in automated driving,I was confused""","Logo and blue",1000,3,"",3,"","I realized I used the wrong names before, I got it now, dont feel comfortable with taking hands off","","I dont know","System error",0,0,"Regular",0,"","If it wasnt for the yellow flashing and sound I would Not have noticed it","","",23,3,"",3,"","",NA,"","No",0,0,"",0,"","",""
