9,2020-08-21 09:41:00,46,de,,2020-08-21 07:31:00,2020-08-21 09:41:00,56,2020-08-21 00:00:00,ED,ER,2,67,Männlich,Mehrmals pro Woche,< als 5.000 km,Nein,Nein,,2,Ja,N/A,N/A,N/A,Mehrmals täglich,Honda,,,,,,,Manuelles Fahren,,Nein,,,Nein,Nein,,,Keine Probleme; Schnelles Verarbeiten;1,,Manuelles Fahren,,Nein,,,Nein,Nein,,,Keine Probleme; Schnelles Verarbeiten;1,,Automatisiertes Fahren,,Nein,,,Nein,Nein,Nein,,,"Nur 1 mal FAS, somit nur in assistiert, Hände aber am Lenkrad, antwortet er war in automatisiert, antwortet er darf hände aber nicht wegnehmen?!, Erklärung von mir","Hilfe vom Experimenter; Mehrere Fehler Massive Fehler erfordern einen Neustart der Aufgabe, Hilfe des Experimentators erforderlich; 5",,Automatisiertes Fahren,,Nein,,,Ja,Ja,,"spielt kein SURT, vergessen oder unklar, Erklärung von mir nochmals dass er spielen kann","Zögern; Unabhängige Lösung ohne Fehler Aber: Zögern, sehr bewusstes Handeln und volle Konzentration; 2",,Assistiertes Fahren,,Ja,Sonstiges,meint er war im automatisierten,Nein,Nein,Nein,,,"er weiß nicht mehr, dass er selber in assistiert geschaltet hat, denkt dass wo hands on aufforderung kam, dass Sysrem selber gewechselt hat, hat keinen Überblick über HMI und Stufen und Anzeigen (Texte)","Kleinere Fehler; Unabhängige Lösung ohne oder mit kleineren Fehlern, die selbstbewusst korrigiert Aber: Längere Denkpausen Bewertung möglicher Arbeitsschritte; 3",,Assistiertes Fahren,,Ja,Sonstiges,nicht verstanden,Nichts erkannt,,Nein,Nein,,"sieht zwar Text, versteht ihn aber nicht, da zu kurz, somit auch keine Änderung der Verfügbarkeit erkannt, HMI zu schlecht",Keine Probleme; Schnelles Verarbeiten;1,,Assistiertes Fahren,,Nein,,,Nein,Nein,,,Keine Probleme; Schnelles Verarbeiten;1,,Assistiertes Fahren,,Ja,Automatisiert verfügbar,,Nein,Nein,,"sieht und liest verfügbarkeit, antwortet auch dementsprechend, drückt aber zu Beginn 1 mal MOD dann erst FAS um in Assistiert zu kommen","Kleinere Fehler; Unabhängige Lösung ohne oder mit kleineren Fehlern, die selbstbewusst korrigiert Aber: Längere Denkpausen Bewertung möglicher Arbeitsschritte; 3",,Automatisiertes Fahren,,Nein,,,Ja,Ja,Nein,,,"wieder MOD 2mal um in Assistiert zu kommen, dann erst FAS, auch in TC 8 mit MOD versucht, davor immer richtig gemacht ?!","Kleinere Fehler; Unabhängige Lösung ohne oder mit kleineren Fehlern, die selbstbewusst korrigiert Aber: Längere Denkpausen Bewertung möglicher Arbeitsschritte; 3",,Manuelles Fahren,,Nein,,,,,Nein,Nein,Nein,,,"nimmt nichts wahr, Notbremsung kommt, Aufforderung von mir zu Bremsen, dadurch auch Antwort keine Probleme bei Wechsel zwischen Stufen, siehe frage davor","Hilfe vom Experimenter; Mehrere Fehler Massive Fehler erfordern einen Neustart der Aufgabe, Hilfe des Experimentators erforderlich; 5",,Automatisiertes Fahren,,Nein,,,Ja,Ja,Nein,,,"sieht auf Video Verfügbarkeitsänderung sagt aber nein, Handelt aber richtig bei Durchsage, nimmt Verfügbarkeit nicht wahr oder vergessen wegen Durchsage, Problem auch bei anderen PProbanden","Zögern; Unabhängige Lösung ohne Fehler Aber: Zögern, sehr bewusstes Handeln und volle Konzentration; 2",,Manuelles Fahren,,Nein,,,,,Nein,Nein,Nein,,,"nimmt nichts wahr, Notbremsung kommt, nur auf meine Aufforderung bremst er dann, nimmt keine Verfügbarkeitsänderung wahr, deswegen auch keine Probleme bei Wechsel zu manuell","Hilfe vom Experimenter; Mehrere Fehler Massive Fehler erfordern einen Neustart der Aufgabe, Hilfe des Experimentators erforderlich; 5",,5,3,4,2,4,2,3,2,4,Stimme gar nicht zu - 1,4,2,3,Stimme gar nicht zu - 1,4,4,5,4,2,3,2,5,6,6,1,2,7,1,4,6,6,5,2,2,3,2,3,3,2,2,2,6,"Darstellung im Display

","Schriftliche Darstellung
",,,1,2,
10,2020-08-21 10:57:56,46,de,1356941308,2020-08-21 09:54:58,2020-08-21 10:57:56,57,2020-08-21 00:00:00,GE,JO,1,23,Weiblich,Täglich,5.001 - 10.000 km,"Ja, ich nutze sie jetzt nicht",Nein,,3,Ja,Nein,Ja,Nein,Wöchentlich,"Audi, BMW, VW, Mercedes",,,Täglich,"Audi, BMW",,,Manuelles Fahren,,Nein,,,Nein,Nein,,,Keine Probleme; Schnelles Verarbeiten;1,,Manuelles Fahren,,Ja,Automatisiert verfügbar,,Nein,Nein,,,Keine Probleme; Schnelles Verarbeiten;1,,Automatisiertes Fahren,,Nein,,,Nein,Nein,Nein,,,"drückt 1 mal FAS und ist in Assistiert, Antwortet sie ist in Automatisiert, hat noch Hände am Lenkrad, antwortet auch sie darf Hände nicht wegnehmen?!","Zögern; Unabhängige Lösung ohne Fehler Aber: Zögern, sehr bewusstes Handeln und volle Konzentration; 2",,Assistiertes Fahren,,Nein,,,Nein,Nein,,"unsicher welches Level sie sich befindet, Anzeige zu schlecht, spielt deshalb auch kein SURT, Erklärung von mir","Zögern; Unabhängige Lösung ohne Fehler Aber: Zögern, sehr bewusstes Handeln und volle Konzentration; 2",,Assistiertes Fahren,,Nein,,,Nein,Nein,Nein,,,,Keine Probleme; Schnelles Verarbeiten;1,,Assistiertes Fahren,,Ja,Automatisiert nicht mehr verfügbar,,Sensorfehler,,Nein,Nein,,,Keine Probleme; Schnelles Verarbeiten;1,,Assistiertes Fahren,,Nein,,,Nein,Nein,,,Keine Probleme; Schnelles Verarbeiten;1,,Assistiertes Fahren,,Ja,Automatisiert verfügbar,,Nein,Nein,,"drückt bei Ton Versuchsbeginn kurz aus, dann wieder an",Keine Probleme; Schnelles Verarbeiten;1,,Automatisiertes Fahren,,Nein,,,Ja,Ja,Nein,,,"immer 1 Hand am Lenkrad immer noch, aber volles Verständnis",Keine Probleme; Schnelles Verarbeiten;1,,Manuelles Fahren,,Nein,,,,,Nein,Nein,Nein,,,"nimmt nichts wahr, Notbremsung kommt, Aufforderung von mir zu bremsen, Frage nach Probleme bei Übersteuern hinfällig","Hilfe vom Experimenter; Mehrere Fehler Massive Fehler erfordern einen Neustart der Aufgabe, Hilfe des Experimentators erforderlich; 5",,Automatisiertes Fahren,,Ja,Automatisiert verfügbar,,Ja,Ja,Nein,,,1 Hand immer am Lenkrad,Keine Probleme; Schnelles Verarbeiten;1,,Manuelles Fahren,,Ja,Sonstiges,weiß nicht ob noch was verfügbar wäre,Sensorfehler,,Nein,Nein,Nein,,,"sieht Fehler drückt MOD, dann kommt Notbremsung, sie bremst daraufhin",Massive Fehler; Ein oder mehrere Fehler Deutlich beeinträchtigter Operationsablauf Übermäßige Korrektur von Fehlern Keine Hilfe des Experimentators erforderlich; 4,,6,2,6,2,Stimme voll zu - 5,Stimme gar nicht zu - 1,Stimme voll zu - 5,Stimme gar nicht zu - 1,4,Stimme gar nicht zu - 1,4,Stimme gar nicht zu - 1,4,4,4,4,6,7,3,1,2,7,7,6,1,2,7,1,7,6,6,6,2,4,2,6,2,6,2,2,2,7,"Das automatisierte Fahren testen, ist eine sehr hilfreiche und auch bereichernde Erfahrung.",,,,1,1,
11,2020-08-22 12:20:18,46,de,2095817457,2020-08-22 10:35:42,2020-08-22 12:20:18,58,2020-08-22 00:00:00,Er,Mi,22,24,Männlich,Täglich,10.001 - 20.000 km,Nein,Nein,,2,Nein,Nein,Nein,Ja,,,,,,,,,Manuelles Fahren,,Nein,,,Nein,Nein,,,Keine Probleme; Schnelles Verarbeiten;1,,Manuelles Fahren,,Ja,Automatisiert verfügbar,,Nein,Nein,,,Keine Probleme; Schnelles Verarbeiten;1,,Automatisiertes Fahren,,Nein,,,Ja,Ja,Nein,,,,"Zögern; Unabhängige Lösung ohne Fehler Aber: Zögern, sehr bewusstes Handeln und volle Konzentration; 2",,Automatisiertes Fahren,,Nein,,,Ja,Ja,,,Keine Probleme; Schnelles Verarbeiten;1,,Assistiertes Fahren,,Nein,,,Nein,Nein,Nein,,,,Keine Probleme; Schnelles Verarbeiten;1,,Assistiertes Fahren,,Nein,,,,,Nein,Nein,,"Unsicher ob er im assistierten auch Hände wegnehmen darf, Nachfrage und Antwort von mir",Keine Probleme; Schnelles Verarbeiten;1,,Assistiertes Fahren,,Nein,,,Nein,Nein,,,Keine Probleme; Schnelles Verarbeiten;1,,Assistiertes Fahren,,Ja,Automatisiert verfügbar,,Nein,Nein,,,Keine Probleme; Schnelles Verarbeiten;1,,Automatisiertes Fahren,,Nein,,,Ja,Ja,Nein,,,,Keine Probleme; Schnelles Verarbeiten;1,,Manuelles Fahren,,Ja,Keines mehr verfügbar,,Sonstiges,Notbremsung,Nein,Nein,Nein,,"Schlechte Warnung, soll Ton geben...","Nimmt nichts wahr, erst bei Notbremsung schaut er hin und übersteuert durch FAS","Zögern; Unabhängige Lösung ohne Fehler Aber: Zögern, sehr bewusstes Handeln und volle Konzentration; 2",,Automatisiertes Fahren,,Ja,Automatisiert verfügbar,,Ja,Ja,Nein,,,,Keine Probleme; Schnelles Verarbeiten;1,,Manuelles Fahren,,Ja,Keines mehr verfügbar,,Sensorfehler,,Nein,Nein,Ja,"hat instinktiv auf Bremse gedrückt, vielleicht nicht das beste",,FAS und gebremst,"Zögern; Unabhängige Lösung ohne Fehler Aber: Zögern, sehr bewusstes Handeln und volle Konzentration; 2",,Stimme gar nicht zu - 1,3,6,4,Stimme gar nicht zu - 1,2,4,Stimme gar nicht zu - 1,3,2,4,2,2,Stimme gar nicht zu - 1,Stimme gar nicht zu - 1,Stimme gar nicht zu - 1,5,5,3,2,2,7,7,2,2,2,7,5,6,7,7,6,7,6,3,6,2,6,1,1,1,6,"einfach gestaltetes Display, einfach verständliche Symbole","Warnhinweise brauchen Töne , sonst ist das System völlig unbenutzbar und unsicher","Warntöne, wenn Sensorfehler oder Notbremsung auftritt",,1,1,
12,2020-08-24 17:44:05,46,de,1246698016,2020-08-24 16:25:21,2020-08-24 17:44:05,59,2020-08-24 00:00:00,BO,SI,10,25,Weiblich,Mehrmals pro Monat,< als 5.000 km,"Ja, ich nutze sie auch jetzt",Nein,,1,Nein,Nein,Nein,Ja,,,,,,,,,Manuelles Fahren,,Nein,,,Nein,Nein,,,Keine Probleme; Schnelles Verarbeiten;1,,Manuelles Fahren,,Ja,Automatisiert verfügbar,,Nein,Nein,,,Keine Probleme; Schnelles Verarbeiten;1,,Automatisiertes Fahren,,Nein,,,Ja,Ja,Nein,,,"glaubt sie ist in Automatisiert, 1 mal FAS nur, spielt SURT, HOD kommt mit Pipsen sogar, dann Hände am Lenkrad, spielt SURT aber weiter","Hilfe vom Experimenter; Mehrere Fehler Massive Fehler erfordern einen Neustart der Aufgabe, Hilfe des Experimentators erforderlich; 5",,Automatisiertes Fahren,,Nein,,,Ja,Ja,,"fragt nach, ob sie wirklich im automatisierten ist, Antwort von mir","Zögern; Unabhängige Lösung ohne Fehler Aber: Zögern, sehr bewusstes Handeln und volle Konzentration; 2",,Assistiertes Fahren,,Nein,,,Nein,Nein,Nein,,,"zu beginn ausversehen 2 mal MOD dadurch in Assistiert, Ansage von mir, sehr unsicher bei wechsel zu assistiert wie wirklich gemacht werden soll","Zögern; Unabhängige Lösung ohne Fehler Aber: Zögern, sehr bewusstes Handeln und volle Konzentration; 2",,Assistiertes Fahren,,Ja,Automatisiert nicht mehr verfügbar,,Sensorfehler,,Nein,Nein,,,Keine Probleme; Schnelles Verarbeiten;1,,Assistiertes Fahren,,Nein,,,Nein,Nein,,,Keine Probleme; Schnelles Verarbeiten;1,,Assistiertes Fahren,,Ja,Automatisiert verfügbar,,Nein,Nein,,,Keine Probleme; Schnelles Verarbeiten;1,,Automatisiertes Fahren,,Nein,,,Ja,Ja,Nein,,,,Keine Probleme; Schnelles Verarbeiten;1,,Manuelles Fahren,,Ja,Automatisiert nicht mehr verfügbar,,Systemgrenze,,Nein,Nein,Nein,,,"sieht aufforderung sehr spät, überlegt lange, dann FAS Taste zum übersteuern","Zögern; Unabhängige Lösung ohne Fehler Aber: Zögern, sehr bewusstes Handeln und volle Konzentration; 2",,Automatisiertes Fahren,,Ja,Automatisiert verfügbar,,Ja,Ja,Nein,,,,Keine Probleme; Schnelles Verarbeiten;1,,Manuelles Fahren,,Nein,,,,,Nein,Nein,Nein,,,"weiß nicht wegen der Verfügbarkeit, sieht nur Notbremsung, 
Notbremsung kommt, eher zufällig gesehen dann bremst sie",Massive Fehler; Ein oder mehrere Fehler Deutlich beeinträchtigter Operationsablauf Übermäßige Korrektur von Fehlern Keine Hilfe des Experimentators erforderlich; 4,,5,2,6,2,4,2,4,2,4,2,Stimme voll zu - 5,Stimme gar nicht zu - 1,3,2,3,4,5,6,5,2,2,5,4,5,3,4,6,2,5,5,6,6,3,4,2,6,2,6,1,3,2,5,Die recht einfache Bedienung und klarer Aufbau.,Eventuell etwas schwer wichtige Benachrichtigungen (Notbremse) wirklich wahrzunehmen.,"Ein akustisches Signal im automatisierten Fahren wäre sinnvoll, damit ggf. Nachrichten auf dem Display rechtzeitig erkannt werden können.",Nein.,4,4,Nein.
13,2020-08-25 10:42:53,46,de,1996588362,2020-08-25 09:29:41,2020-08-25 10:42:53,60,2020-08-25 00:00:00,he,wo,19,18,Männlich,Täglich,5.001 - 10.000 km,Nein,Nein,,1,Ja,Nein,Ja,Nein,Täglich,"Audi, Jaguar, BMW, Citroen",,,Wöchentlich,Jaguar,,,Manuelles Fahren,,Nein,,,Nein,Nein,,,Keine Probleme; Schnelles Verarbeiten;1,,Manuelles Fahren,,Ja,Assistiert verfügbar,,Nein,Nein,,"glaubt, dass assistiert verfügbar wurde ?!",Keine Probleme; Schnelles Verarbeiten;1,,Assistiertes Fahren,,Nein,,,Nein,Nein,Nein,,,"1 mal MOD, dann nur 1 mal FAS zu Assistiert, weiß aber er ist in Assistiert...","Kleinere Fehler; Unabhängige Lösung ohne oder mit kleineren Fehlern, die selbstbewusst korrigiert Aber: Längere Denkpausen Bewertung möglicher Arbeitsschritte; 3",,Automatisiertes Fahren,,Nein,,,Ja,Ja,,,"Zögern; Unabhängige Lösung ohne Fehler Aber: Zögern, sehr bewusstes Handeln und volle Konzentration; 2",,Assistiertes Fahren,,Nein,,,Nein,Nein,Nein,,,,"Zögern; Unabhängige Lösung ohne Fehler Aber: Zögern, sehr bewusstes Handeln und volle Konzentration; 2",,Manuelles Fahren,,Ja,Automatisiert und Assistiert nicht mehr verfügbar,,Sensorfehler,,Nein,Nein,,"Drückt FAS, denkt es ist nichts mehr verfügbar, deshalb auch oben manuell angegeben bei letzter Automationsstufe","Zögern; Unabhängige Lösung ohne Fehler Aber: Zögern, sehr bewusstes Handeln und volle Konzentration; 2",,Assistiertes Fahren,,Nein,,,Nein,Nein,,,Keine Probleme; Schnelles Verarbeiten;1,,Assistiertes Fahren,,Ja,Automatisiert verfügbar,,Nein,Nein,,,Keine Probleme; Schnelles Verarbeiten;1,,Automatisiertes Fahren,,Nein,,,Ja,Ja,Nein,,,"schaut sehr oft auf straße, vorsichtig",Keine Probleme; Schnelles Verarbeiten;1,,Manuelles Fahren,,Ja,Sonstiges,nicht erkannt,Nichts erkannt,,Nein,Nein,Nein,,"erkannt Fehler nicht, da er zu schnell war sagt er","1 mal FAS zum übersteuern, nimmt keine Änderung der Verfügbarkeit wahr, Skala auch somit nicht","Zögern; Unabhängige Lösung ohne Fehler Aber: Zögern, sehr bewusstes Handeln und volle Konzentration; 2",,Automatisiertes Fahren,,Ja,Automatisiert verfügbar,,Ja,Ja,Nein,,,"bei Wechsel erst MOD, dann FAS und MOD","Kleinere Fehler; Unabhängige Lösung ohne oder mit kleineren Fehlern, die selbstbewusst korrigiert Aber: Längere Denkpausen Bewertung möglicher Arbeitsschritte; 3",,Manuelles Fahren,,Ja,Nur Manuell verfügbar,,Sensorfehler,,Nein,Nein,Nein,,,"komplett richtig, allerdings sehr vorsichtig und vorgewarnt",Keine Probleme; Schnelles Verarbeiten;1,,5,4,5,4,4,2,Stimme gar nicht zu - 1,Stimme voll zu - 5,4,2,Stimme voll zu - 5,2,4,Stimme gar nicht zu - 1,4,Stimme voll zu - 5,6,5,5,1,3,4,6,4,3,5,6,3,6,6,5,6,2,5,3,6,3,6,2,3,3,2,"einfach gehalten
Systemversagen schwer sichtbar
einfache Bedienung","Gefahrenmeldungen im Infotainmentbereich und nicht großflächig angezeigt
Möglichkeit Assistenzsysteme zu verwenden war nicht ersichtlich",Gefahrenmeldungen wie System-/Sensorversagen durch Töne/Vibration und großer Schrift signalisieren,"sehr gut zu Bedienen
Meldungen nicht leicht bei der Fahrt ersichtlich
",2,2,"für genauere Ergebnisse müsste die Simulation näher an alltägliche Situationen angepasst sein. 
Beispielsweise andere Teilnehmen, Gefahrensituationen......

Einweisung etwas schwer zu verstehen aber durch Durchsagen leichter zu Bedienen

aber interessante Studie
"
14,2020-08-25 13:31:49,46,de,712122817,2020-08-25 12:31:08,2020-08-25 13:31:48,61,2020-08-25 00:00:00,In,Be,18,26,Weiblich,Mehrmals pro Monat,< als 5.000 km,Nein,Nein,,1,Nein,Nein,Nein,Ja,,,,,,,,,Manuelles Fahren,,Nein,,,Nein,Nein,,,Keine Probleme; Schnelles Verarbeiten;1,,Manuelles Fahren,,Ja,Automatisiert verfügbar,,Nein,Nein,,,Keine Probleme; Schnelles Verarbeiten;1,,Automatisiertes Fahren,,Nein,,,Ja,Ja,Ja,unsicherheit welche Stufe sie jetzt ist,,"nur 1 mal FAS zu Assistiert, dann kommt HOD mit Ton, dann nimmt sie Hände ran, dachte wäre schon automatisiert","Hilfe vom Experimenter; Mehrere Fehler Massive Fehler erfordern einen Neustart der Aufgabe, Hilfe des Experimentators erforderlich; 5",,Automatisiertes Fahren,,Nein,,,Ja,Ja,,Erneut zu Beginn erklärt wie man ins Automatisierte kommt (hat 2 mal FAS gedrückt),Massive Fehler; Ein oder mehrere Fehler Deutlich beeinträchtigter Operationsablauf Übermäßige Korrektur von Fehlern Keine Hilfe des Experimentators erforderlich; 4,,Assistiertes Fahren,,Nein,,,Nein,Nein,Nein,,,,"Zögern; Unabhängige Lösung ohne Fehler Aber: Zögern, sehr bewusstes Handeln und volle Konzentration; 2",,Assistiertes Fahren,,Ja,Automatisiert nicht mehr verfügbar,,Sensorfehler,,Nein,Nein,,"2 mal MOD bevor FAS zu Assistiert, bereits vor Versuchston",Massive Fehler; Ein oder mehrere Fehler Deutlich beeinträchtigter Operationsablauf Übermäßige Korrektur von Fehlern Keine Hilfe des Experimentators erforderlich; 4,,Assistiertes Fahren,,Nein,,,Nein,Nein,,,"Zögern; Unabhängige Lösung ohne Fehler Aber: Zögern, sehr bewusstes Handeln und volle Konzentration; 2",,Assistiertes Fahren,,Ja,Automatisiert verfügbar,,Nein,Nein,,,Keine Probleme; Schnelles Verarbeiten;1,,Automatisiertes Fahren,,Nein,,,Ja,Ja,Nein,,,nimmt zu Beginn Hände weg bis HOD Aufforderung kommt,Keine Probleme; Schnelles Verarbeiten;1,,Manuelles Fahren,,Ja,Keines mehr verfügbar,,Systemgrenze,,Nein,Nein,Nein,,,"Drückt FAS Taste zum übersteuern, jedoch recht spät, reiner Zufall, dass sie Aufforderung sieht","Zögern; Unabhängige Lösung ohne Fehler Aber: Zögern, sehr bewusstes Handeln und volle Konzentration; 2",,Automatisiertes Fahren,,Ja,Automatisiert verfügbar,,Ja,Ja,Nein,,,,Keine Probleme; Schnelles Verarbeiten;1,,Manuelles Fahren,,Ja,Keines mehr verfügbar,,Sensorfehler,,Nein,Nein,Nein,,,"FAS-Taste zum übersteuern, sieht eher zufällig da sehr vorsichtig und erwartungsvoll, dass was passiert","Zögern; Unabhängige Lösung ohne Fehler Aber: Zögern, sehr bewusstes Handeln und volle Konzentration; 2",,2,Stimme gar nicht zu - 1,5,2,3,Stimme gar nicht zu - 1,4,2,2,Stimme gar nicht zu - 1,4,3,3,2,2,2,3,6,6,2,3,3,3,4,2,3,5,3,6,4,6,4,5,6,2,4,2,4,2,6,5,6,"unauffällig, nicht zu dominant","Kein Warnton bei Übernahmeaufforderung. Man musste zufällig auf die Anzeige schauen, um zu sehen, dass man übernehmen muss.",Warntöne bei Übernahme-Muss,,3,4,
15,2020-08-25 18:29:24,46,de,242146974,2020-08-25 17:01:53,2020-08-25 18:29:24,62,2020-08-25 00:00:00,ed,ed,20,47,Weiblich,Mehrmals pro Woche,5.001 - 10.000 km,"Ja, ich nutze sie auch jetzt",Nein,,Keine Kenntnisse - 0,Ja,Nein,Nein,Nein,Monatlich,Fiat Ducato,,,,,,,Manuelles Fahren,,Nein,,,Nein,Nein,,,Keine Probleme; Schnelles Verarbeiten;1,,Manuelles Fahren,,Ja,Automatisiert verfügbar,,Nein,Nein,,,Keine Probleme; Schnelles Verarbeiten;1,,Automatisiertes Fahren,,Nein,,,Nein,Nein,Nein,,,"1 mal FAS ist in Assistiert, glaubt ist in Automatisiert, glaubt aber auch, dass sie die Hände nicht wegnehmen darf, große Unsicherheit bzgl der Level","Hilfe vom Experimenter; Mehrere Fehler Massive Fehler erfordern einen Neustart der Aufgabe, Hilfe des Experimentators erforderlich; 5",,Automatisiertes Fahren,,Nein,,,Nein,Nein,,"Projeziert die SAE Level auf das Ego Fahrzeug, enorm Unsicher welches Level sie ist, Hände trotz Automatisiert Hände am Lenkrad","Zögern; Unabhängige Lösung ohne Fehler Aber: Zögern, sehr bewusstes Handeln und volle Konzentration; 2",,Assistiertes Fahren,,Nein,,,Nein,Nein,Nein,,,"2 mal FAS um in Assistiert zu kommen, nimmt bei Automatisiert die Hand nicht weg, kennt namen der Level nicht gut","Kleinere Fehler; Unabhängige Lösung ohne oder mit kleineren Fehlern, die selbstbewusst korrigiert Aber: Längere Denkpausen Bewertung möglicher Arbeitsschritte; 3",,Assistiertes Fahren,,Ja,Sonstiges,Assistiert nicht mehr verfügbar,Sensorfehler,,Nein,Nein,,"glaubt Fehler hat angezeigt, dass Assistiert nicht mehr verfügbar ist und es geht trotzdem",Massive Fehler; Ein oder mehrere Fehler Deutlich beeinträchtigter Operationsablauf Übermäßige Korrektur von Fehlern Keine Hilfe des Experimentators erforderlich; 4,,Assistiertes Fahren,,Nein,,,Nein,Nein,,Frage zur Verfügbarkeit verwirrt Sie,Keine Probleme; Schnelles Verarbeiten;1,,Automatisiertes Fahren,,Ja,Automatisiert verfügbar,,Ja,Ja,,"schaltet bei reiner Verfügbarkeit, aber alles richtig, Antwortet auch auf Fragen richtig","Zögern; Unabhängige Lösung ohne Fehler Aber: Zögern, sehr bewusstes Handeln und volle Konzentration; 2",,Automatisiertes Fahren,,Nein,,,Ja,Ja,Nein,,,"nimmt zum 1 mal die Hand weg, evtl mehr vertrauen","Zögern; Unabhängige Lösung ohne Fehler Aber: Zögern, sehr bewusstes Handeln und volle Konzentration; 2",,Manuelles Fahren,,Nein,,,,,Nein,Nein,Nein,,,"überhaupt nichts wahrgenommen, Notbremsung kommt, Aufforderung von mir zu bremsen, nimmt keine Verfügbarkeitsändernug war, Frage nach Problem bei wechsel sinnlos (Nein von mir)","Hilfe vom Experimenter; Mehrere Fehler Massive Fehler erfordern einen Neustart der Aufgabe, Hilfe des Experimentators erforderlich; 5",,Automatisiertes Fahren,,Ja,Automatisiert verfügbar,,Ja,Ja,Nein,,,,"Zögern; Unabhängige Lösung ohne Fehler Aber: Zögern, sehr bewusstes Handeln und volle Konzentration; 2",,Manuelles Fahren,,Ja,Keines mehr verfügbar,,Sensorfehler,,Nein,Nein,Nein,,,"brutal vorgewarnt, sieht den Fehler dadurch, drückt FAS Taste zum übersteuern","Zögern; Unabhängige Lösung ohne Fehler Aber: Zögern, sehr bewusstes Handeln und volle Konzentration; 2",,2,4,6,3,2,3,Stimme voll zu - 5,Stimme gar nicht zu - 1,3,3,2,Stimme gar nicht zu - 1,Stimme voll zu - 5,2,2,2,5,5,3,1,4,6,6,5,3,4,6,4,7,4,7,4,4,6,4,4,6,4,4,3,3,4,Die Erfahrung in solch eine Fahrzeug zu sitzen und das Gefühl vom Fahrzeug geführt zu werden.,"die Hinweise waren nur im Display sichtbar, nicht aber als akustischer Ton. Wäre gut, wenn man hier etwas dazu schalten kann.",Akustische Signale oder anderweitige besser sichtbare Hinweise,,1,1,
16,2020-08-26 11:17:12,46,de,611002604,2020-08-26 09:49:09,2020-08-26 11:17:12,63,2020-08-26 00:00:00,Ve,Ru,22,52,Männlich,Täglich,10.001 - 20.000 km,"Ja, ich nutze sie jetzt nicht",Nein,,2,Ja,Ja,Ja,Nein,Wöchentlich,BMW Audi,Wöchentlich,Mercedes BMW Audi,Nie,Mercedes BMW Audi,,,Manuelles Fahren,,Nein,,,N/A,Nein,,,Keine Probleme; Schnelles Verarbeiten;1,,Assistiertes Fahren,,Nein,,,Nein,Nein,,"schaltet mit FAs in Assistiert bei reiner Verfügabrkeit, Spielt SURT, HOD kommt mit Pips, dann Hände am Lenkrad, und das ganze nochmal gemacht, antwortet aber er ist nur in 1 stufe...
sagt nimmt keine Verfügbarkeit wahr, obwohl er schaltet, wieder mal verständigunngsproblem","Hilfe vom Experimenter; Mehrere Fehler Massive Fehler erfordern einen Neustart der Aufgabe, Hilfe des Experimentators erforderlich; 5",,Automatisiertes Fahren,,Nein,,,Ja,Ja,Nein,,,"kein Probleme bei wechsel, da Erklärung von mir zuvor","Zögern; Unabhängige Lösung ohne Fehler Aber: Zögern, sehr bewusstes Handeln und volle Konzentration; 2",,Automatisiertes Fahren,,Nein,,,Ja,Ja,,,Keine Probleme; Schnelles Verarbeiten;1,,Assistiertes Fahren,,Nein,,,Nein,Nein,Nein,,,"Probleme mit frage nach Verfügbarkeit, wie viele andere auch schon","Zögern; Unabhängige Lösung ohne Fehler Aber: Zögern, sehr bewusstes Handeln und volle Konzentration; 2",,Assistiertes Fahren,,Ja,Sonstiges,"assistiert nicht verfügbar seiner Meinung, geht aber trotzdem findet er komisch",Sensorfehler,,Nein,Nein,,"glaubt assistiert nicht mehr verfügbar, verwirrt dass kein ton kommt oder ähnliches, bleibt in der Stufe deshalb auch",Keine Probleme; Schnelles Verarbeiten;1,,Assistiertes Fahren,,Nein,,,Nein,Nein,,,Keine Probleme; Schnelles Verarbeiten;1,,Automatisiertes Fahren,,Ja,Automatisiert verfügbar,,Ja,Ja,,"bei reiner Verfügbarkeit geschaltet, aber richtig, antwortet auch richtig, man muss leute dann im glauben lassen es bringt nichts zu sagen bei reiner Verfügbarkeit schalten","Zögern; Unabhängige Lösung ohne Fehler Aber: Zögern, sehr bewusstes Handeln und volle Konzentration; 2",,Automatisiertes Fahren,,Nein,,,Ja,Ja,Nein,,,schaltet bereits bei TC8 in automatisiert,Keine Probleme; Schnelles Verarbeiten;1,,Manuelles Fahren,,Ja,Keines mehr verfügbar,,Systemgrenze,,Nein,Nein,Ja,sagt selber drückt erst MOD dann weiß er dass er FAS drücken soll/muss,,"zufällig gesehen, bisschen Button smashing, aber dann korrekt, MOD, MOD, FAS, FAS, FAS ?!","Kleinere Fehler; Unabhängige Lösung ohne oder mit kleineren Fehlern, die selbstbewusst korrigiert Aber: Längere Denkpausen Bewertung möglicher Arbeitsschritte; 3",,Automatisiertes Fahren,,Ja,Automatisiert verfügbar,,Ja,Ja,Nein,,,,Keine Probleme; Schnelles Verarbeiten;1,,Manuelles Fahren,,Ja,Keines mehr verfügbar,,Sonstiges,systemfehler,Nein,Nein,Nein,,,"übersteuert mit 1 mal FAS, schaut sehr oft rüber",Keine Probleme; Schnelles Verarbeiten;1,,3,6,2,6,2,4,4,Stimme gar nicht zu - 1,3,3,Stimme gar nicht zu - 1,2,3,2,4,4,3,5,6,2,1,5,7,2,1,2,7,1,2,4,7,7,1,3,2,7,6,4,1,1,2,7,,"System veraltet im vergleich zu den in aktuellen Autos verbauten Systemen 
Keine Akustische Unterstützung
Keine Visuelle Unterstützung",Akustische und Visuelle Unterstützung für den Fahrer,,1,2,Alles Gut !
