19,2020-08-28 14:51:16,46,de,1595127533,2020-08-28 13:29:08,2020-08-28 14:51:16,65,2020-08-28 00:00:00,K,T,7,22,Männlich,Mehrmals pro Woche,10.001 - 20.000 km,Nein,Nein,,Keine Kenntnisse - 0,Nein,Nein,Nein,Ja,,,,,,,,,Manuelles Fahren,,Nein,,,Nein,Nein,,,Keine Probleme; Schnelles Verarbeiten;1,,Manuelles Fahren,,Ja,Automatisiert verfügbar,,Nein,Nein,,,Keine Probleme; Schnelles Verarbeiten;1,,Assistiertes Fahren,,Nein,,,Nein,Nein,Ja,"bisschen, erst MOD taste, dann war klar",,"2 mal MOD, dann FAS, weiß aber dass er nur in assistiert ist also das ist eigentlich richtig","Hilfe vom Experimenter; Mehrere Fehler Massive Fehler erfordern einen Neustart der Aufgabe, Hilfe des Experimentators erforderlich; 5",,Automatisiertes Fahren,,Nein,,,Ja,Ja,,,Keine Probleme; Schnelles Verarbeiten;1,,Assistiertes Fahren,,Nein,,,Nein,Nein,Nein,,,,Keine Probleme; Schnelles Verarbeiten;1,,Assistiertes Fahren,,Ja,Automatisiert nicht mehr verfügbar,,Sensorfehler,,Nein,Nein,,"kurz in automatisiert geschaltet, aber sofort korrigiert, zuckt kurz bei Sensorfehler ob er handeln muss",Keine Probleme; Schnelles Verarbeiten;1,,Assistiertes Fahren,,Nein,,,Nein,Nein,,,Keine Probleme; Schnelles Verarbeiten;1,,Assistiertes Fahren,,Ja,Automatisiert verfügbar,,Nein,Nein,,,Keine Probleme; Schnelles Verarbeiten;1,,Automatisiertes Fahren,,Nein,,,Ja,Ja,Nein,,,,Keine Probleme; Schnelles Verarbeiten;1,,Manuelles Fahren,,Ja,Sonstiges,nichts wahrgenommen,Systemgrenze,,Nein,Nein,Nein,,,"spielt konzentriert, sieht aber Aufforderung, handelt aber nicht,
Liest NICHT wechseln sie zu manuelles Fahren!!!!","Hilfe vom Experimenter; Mehrere Fehler Massive Fehler erfordern einen Neustart der Aufgabe, Hilfe des Experimentators erforderlich; 5",,Automatisiertes Fahren,,Ja,Automatisiert verfügbar,,Ja,Ja,Nein,,,Änderung Verfügbarkeit auf Nachfrage doch gesehen!!,Keine Probleme; Schnelles Verarbeiten;1,,Manuelles Fahren,,Ja,Sonstiges,nichts gesehen,Sonstiges,systemfehler,Nein,Nein,Ja,"realisiert, dass selber übernehmen ja, aber die reaktion war hände ans lenkrad, wusste aber nicht wirklich wie kontrolle zu übernehmen",,"sieht es spät, dann stress, dann MOD dann Notbremsung kommt, dann bremsen",Massive Fehler; Ein oder mehrere Fehler Deutlich beeinträchtigter Operationsablauf Übermäßige Korrektur von Fehlern Keine Hilfe des Experimentators erforderlich; 4,,6,3,3,4,2,2,4,Stimme gar nicht zu - 1,3,2,3,2,2,Stimme gar nicht zu - 1,2,2,5,5,5,2,4,4,3,3,3,5,4,3,3,3,4,3,5,5,5,4,5,4,2,5,5,4,optisch klar getrennt zwischen Assistiertem und Automatischem fahren,"keine Akustischen Meldungen des Systems selbst (bei Warnungen/Verfügbarkeiten), Meldungen waren auf der Rechten Seite des Displays - gegenüberliegend vom Tacho, auf den man schaut","- akustische Meldungen für Warnungen und Hinweise/Verfügbarkeiten
- Meldungen z.B. oben mittig im Display anzeigen lassen, dort sieht man sie (wenn man auf die Straße schaut) auch eher aus dem Augenwinkel","hat Spaß gemacht, das mal zu testen; leider eine Fehlbedienung von meiner seits",2,2,/
20,2020-08-29 11:37:54,46,de,1829280311,2020-08-29 10:00:34,2020-08-29 11:37:54,66,2020-08-29 00:00:00,EL,RU,5,70,Weiblich,Mehrmals pro Woche,5.001 - 10.000 km,"Ja, ich nutze sie auch jetzt",Nein,,Keine Kenntnisse - 0,Ja,Nein,Nein,Nein,Nie,Mercedes,,,,,,,Manuelles Fahren,,Nein,,,Nein,Nein,,,Keine Probleme; Schnelles Verarbeiten;1,,Manuelles Fahren,,Ja,Automatisiert verfügbar,,Nein,Nein,,,Keine Probleme; Schnelles Verarbeiten;1,,Automatisiertes Fahren,,Nein,,,Ja,Ja,Nein,,,"1 mal FAS in Assistiert, glaubt ist in Automatisiert nimmt auch Hände weg, HOD kommt, nimmt Hände aber nicht wirklich ran (Versuch vorbei), Erklärung von mir","Hilfe vom Experimenter; Mehrere Fehler Massive Fehler erfordern einen Neustart der Aufgabe, Hilfe des Experimentators erforderlich; 5",,Automatisiertes Fahren,,Nein,,,Ja,Ja,,,"Zögern; Unabhängige Lösung ohne Fehler Aber: Zögern, sehr bewusstes Handeln und volle Konzentration; 2",,Assistiertes Fahren,,Nein,,,Nein,Nein,Nein,,,"nimmt Hände bei Assistiert auch weg, ziemlich unsicher, HOD kommt aber erst bei Pips Ton nimmt Sie Hände ran, Erklärung von mir nochmal","Zögern; Unabhängige Lösung ohne Fehler Aber: Zögern, sehr bewusstes Handeln und volle Konzentration; 2",,Assistiertes Fahren,,Ja,Automatisiert nicht mehr verfügbar,,Sensorfehler,,Nein,Nein,,,Keine Probleme; Schnelles Verarbeiten;1,,Assistiertes Fahren,,Nein,,,Nein,Nein,,,Keine Probleme; Schnelles Verarbeiten;1,,Assistiertes Fahren,,Ja,Automatisiert verfügbar,,Nein,Nein,,,Keine Probleme; Schnelles Verarbeiten;1,,Automatisiertes Fahren,,Nein,,,Ja,Ja,Nein,,,"spielt sehr zögerlich nur den SURT, bisschen misstrauisch und vorsichtig, denke Vertrauen nicht sehr groß",Keine Probleme; Schnelles Verarbeiten;1,,Manuelles Fahren,,Ja,Keines mehr verfügbar,,Systemgrenze,,Nein,Nein,Nein,,,"liest Fehler macht aber nichts, Notbremsung kommt, Ansage bon mir zu bremsen, Handelt nicht weil sie nicht sicher war, ob explizite Aufforderung, Bei Nachfrage hätte mit MOD dann FAS übersteuert!!","Hilfe vom Experimenter; Mehrere Fehler Massive Fehler erfordern einen Neustart der Aufgabe, Hilfe des Experimentators erforderlich; 5",,Automatisiertes Fahren,,Nein,,,Ja,Ja,Nein,,,"keine Änderung wahrgenommen, denke aber wie schon sehr oft, geht unter wegen der Durchsage!!",Keine Probleme; Schnelles Verarbeiten;1,,Manuelles Fahren,,Ja,Keines mehr verfügbar,,Sensorfehler,,Nein,Nein,Nein,,,"schaut sehr viel auf Kombidisplay, nimmt nur Hände ans Lenkrad, dann kommt Notbremsung bremst dann",Massive Fehler; Ein oder mehrere Fehler Deutlich beeinträchtigter Operationsablauf Übermäßige Korrektur von Fehlern Keine Hilfe des Experimentators erforderlich; 4,,6,2,6,2,4,2,4,2,4,Stimme gar nicht zu - 1,3,Stimme gar nicht zu - 1,Stimme voll zu - 5,2,4,4,6,6,4,2,4,4,6,4,4,4,6,2,5,4,6,6,2,3,4,6,3,4,3,4,4,6,"Anzeigen übersichtlich, leicht zu verstehen und handzuhaben","Befehle nicht gleich verständlich (Bei Fehlermeldungen),", Unterschiedliche Töne bei Fehlermeldung oder Hinweise von System,,1,1,
21,2020-09-03 14:08:45,46,de,1523287819,2020-09-03 13:01:44,2020-09-03 14:08:45,67,2020-09-03 00:00:00,Bi,Er,22,20,Männlich,Mehrmals pro Monat,< als 5.000 km,"Ja, ich nutze sie auch jetzt",Nein,,Keine Kenntnisse - 0,Ja,Nein,Nein,Nein,Monatlich,Audi,,,,,,,Manuelles Fahren,,Nein,,,Nein,Nein,,,Keine Probleme; Schnelles Verarbeiten;1,,Manuelles Fahren,,Ja,Sonstiges,keine Ahnung was verfügbar wurde nut gelesen das was verfügbar ist,Nein,Nein,,keine Ahnung was verfügbar wurde,Keine Probleme; Schnelles Verarbeiten;1,,Automatisiertes Fahren,,Nein,,,Ja,Nein,Nein,,,"1 mal FAS, keine Ahnung welcher Modus er ist, HOD kommt und nimmt er nicht wahr, Ende der Fahrt, widersprüchliche Angaben bei was er darf und nicht","Hilfe vom Experimenter; Mehrere Fehler Massive Fehler erfordern einen Neustart der Aufgabe, Hilfe des Experimentators erforderlich; 5",,Automatisiertes Fahren,,Nein,,,Ja,Nein,,"nimmt Hand nicht weg und spielt kein SURT, erst später die Hand weg, glaubt er darf keine Email beantworten deshalb auch kein Spiel, Erklärung nochmals von mir, deshalb auch die widersprüchlichen Angaben bei TC3","Zögern; Unabhängige Lösung ohne Fehler Aber: Zögern, sehr bewusstes Handeln und volle Konzentration; 2",,Assistiertes Fahren,,Nein,,,Nein,Nein,Nein,,,,Keine Probleme; Schnelles Verarbeiten;1,,Automatisiertes Fahren,,Ja,Automatisiert nicht mehr verfügbar,,Sensorfehler,,Nein,Nein,,,Keine Probleme; Schnelles Verarbeiten;1,,Automatisiertes Fahren,,Nein,,,Nein,Nein,,,Keine Probleme; Schnelles Verarbeiten;1,,Assistiertes Fahren,,Ja,Automatisiert verfügbar,,Nein,Nein,,,Keine Probleme; Schnelles Verarbeiten;1,,Automatisiertes Fahren,,Nein,,,Ja,Ja,Nein,,,,Keine Probleme; Schnelles Verarbeiten;1,,Manuelles Fahren,,Ja,Keines mehr verfügbar,,Systemgrenze,,Nein,Nein,Nein,,,"liest es zufällig, macht aber nichts!, erst bei Notbremsung bremst er, auf Nachfrage: war sich unsicher, ob es eine explizite Aufforderung ist!",Massive Fehler; Ein oder mehrere Fehler Deutlich beeinträchtigter Operationsablauf Übermäßige Korrektur von Fehlern Keine Hilfe des Experimentators erforderlich; 4,,Automatisiertes Fahren,,Ja,Automatisiert verfügbar,,Ja,Ja,Nein,,,,Keine Probleme; Schnelles Verarbeiten;1,,Manuelles Fahren,,Ja,Keines mehr verfügbar,,Sensorfehler,,Nein,Nein,Nein,,,1 mal FAS ist sehr vorgewarnt,Keine Probleme; Schnelles Verarbeiten;1,,5,2,5,5,3,Stimme gar nicht zu - 1,4,Stimme gar nicht zu - 1,Stimme voll zu - 5,Stimme gar nicht zu - 1,4,Stimme gar nicht zu - 1,3,4,4,4,6,5,2,4,3,7,6,4,3,2,6,2,3,5,7,6,3,4,2,6,2,3,2,2,3,7,Möglichkeit ohne Aufpassen zu Fahren,,Größere Fehlermeldungsanzeige,,4,4,
22,2020-09-03 17:24:37,46,de,497797318,2020-09-03 16:07:19,2020-09-03 17:24:37,68,2020-09-03 00:00:00,XU,HU,28,43,Männlich,Mehrmals pro Woche,10.001 - 20.000 km,Nein,Nein,,2,Ja,Nein,Nein,Nein,Monatlich,Mercedes-Benz,,,,,,,Manuelles Fahren,,Nein,,,Nein,Nein,,,Keine Probleme; Schnelles Verarbeiten;1,,Manuelles Fahren,,Ja,Assistiert verfügbar,,Nein,Nein,,"glaubt assistiert wurde verfügbar, weiß es aber auch nicht mehr wirklich, sprachliche Barriere evtl.",Keine Probleme; Schnelles Verarbeiten;1,,Assistiertes Fahren,,Nein,,,Nein,Nein,Nein,,,"MOD, FAS, nimmt Hände vom Lenkrad, HOD kommt, nimmt Hand wieder ran, wusste er ist nur im Assistierten Fahren","Hilfe vom Experimenter; Mehrere Fehler Massive Fehler erfordern einen Neustart der Aufgabe, Hilfe des Experimentators erforderlich; 5",,Automatisiertes Fahren,,Nein,,,Ja,Ja,,"Frage nach Änderung der Verfügbarkeit sinnlos, Erklärt mir die Farben des Egofahrzeugs und das HOD in TC 3 kam","Zögern; Unabhängige Lösung ohne Fehler Aber: Zögern, sehr bewusstes Handeln und volle Konzentration; 2",,Assistiertes Fahren,,Nein,,,Nein,Nein,Nein,,,"2 mal FAS um in Assistiert zu kommen, Änderung der Verfügbarkeit Erklärung nochmal versucht...","Kleinere Fehler; Unabhängige Lösung ohne oder mit kleineren Fehlern, die selbstbewusst korrigiert Aber: Längere Denkpausen Bewertung möglicher Arbeitsschritte; 3",,Assistiertes Fahren,,Ja,Automatisiert nicht mehr verfügbar,,Sensorfehler,,Nein,Nein,,Frage nach Verfügbarkeit zumindest hier verstanden,Keine Probleme; Schnelles Verarbeiten;1,,Assistiertes Fahren,,Nein,,,Nein,Nein,,,Keine Probleme; Schnelles Verarbeiten;1,,Assistiertes Fahren,,Ja,Automatisiert verfügbar,,Nein,Nein,,,Keine Probleme; Schnelles Verarbeiten;1,,Automatisiertes Fahren,,Nein,,,Ja,Ja,Nein,,,,"Zögern; Unabhängige Lösung ohne Fehler Aber: Zögern, sehr bewusstes Handeln und volle Konzentration; 2",,Manuelles Fahren,,Ja,Keines mehr verfügbar,,Systemgrenze,,Nein,Nein,Nein,,"nein weil er es gemerkt hat, sonst schon, spielt darauf an, dass es vermutlich zufall war, dass er es sah","zu Beginn mehrfach MOD bevor FAS und MOD um in Automatisiert zu kommen, liest Fehlermeldung, dann mit FAS vorsichtig übersteuert","Zögern; Unabhängige Lösung ohne Fehler Aber: Zögern, sehr bewusstes Handeln und volle Konzentration; 2",,Automatisiertes Fahren,,Nein,,,Ja,Ja,Nein,,,vergisst wie viele andere auch schon dass es eine Verfügbarkeitsanzeige gab,"Zögern; Unabhängige Lösung ohne Fehler Aber: Zögern, sehr bewusstes Handeln und volle Konzentration; 2",,Manuelles Fahren,,Ja,Sonstiges,"nicht gesehen, ob noch was verfügbar wäre",Sensorfehler,,Nein,Nein,Nein,,,"zu Beginn MOD, FAS, MOD; Als Fehler kam überlegt er dann ganz kurz blinkt Notbremsung auf so dass er es aber nicht sieht und drückt die FAS Taste zum Übersteuern","Zögern; Unabhängige Lösung ohne Fehler Aber: Zögern, sehr bewusstes Handeln und volle Konzentration; 2",,Stimme voll zu - 7,Stimme gar nicht zu - 1,6,Stimme gar nicht zu - 1,Stimme voll zu - 5,Stimme gar nicht zu - 1,Stimme voll zu - 5,Stimme gar nicht zu - 1,Stimme voll zu - 5,Stimme gar nicht zu - 1,Stimme voll zu - 5,Stimme gar nicht zu - 1,Stimme voll zu - 5,Stimme gar nicht zu - 1,Stimme voll zu - 5,Stimme voll zu - 5,7,7,1,1,1,7,7,7,1,3,7,1,7,6,7,7,1,1,1,7,1,7,1,1,1,7,Mann könnte neben Fahren auch spielen. Es ist für mich genial!,Bei der Anzeige von Problemen der automatisierten Fahren liebe eher eine Tonsignal!,,,1,2,
23,2020-09-14 09:34:31,46,de,1773618068,2020-09-14 08:19:43,2020-09-14 09:34:31,69,2020-09-14 00:00:00,GE,HA,23,29,Männlich,Mehrmals pro Woche,5.001 - 10.000 km,Nein,Nein,,1,Nein,Nein,Nein,Ja,,,,,,,,,Manuelles Fahren,,Nein,,,Nein,Nein,,"weiß nicht wie die erste stufe heißt also manuell, erklärung von mir",Keine Probleme; Schnelles Verarbeiten;1,,Manuelles Fahren,,Ja,Automatisiert verfügbar,,Nein,Nein,,,Keine Probleme; Schnelles Verarbeiten;1,,Automatisiertes Fahren,,Nein,,,Ja,Ja,Nein,,,3 mal FAS dann MOD in Automatisiert,"Kleinere Fehler; Unabhängige Lösung ohne oder mit kleineren Fehlern, die selbstbewusst korrigiert Aber: Längere Denkpausen Bewertung möglicher Arbeitsschritte; 3",,Automatisiertes Fahren,,Nein,,,Ja,Ja,,,Keine Probleme; Schnelles Verarbeiten;1,,Assistiertes Fahren,,Nein,,,Nein,Nein,Nein,,,,Keine Probleme; Schnelles Verarbeiten;1,,Assistiertes Fahren,,Ja,Automatisiert nicht mehr verfügbar,,Sensorfehler,,Nein,Nein,,"immer wieder mal hände kurz weg, aber nicht der rede wert",Keine Probleme; Schnelles Verarbeiten;1,,Assistiertes Fahren,,Nein,,,Nein,Nein,,,Keine Probleme; Schnelles Verarbeiten;1,,Assistiertes Fahren,,Ja,Automatisiert verfügbar,,Nein,Nein,,,Keine Probleme; Schnelles Verarbeiten;1,,Automatisiertes Fahren,,Nein,,,Ja,Ja,Nein,,,,Keine Probleme; Schnelles Verarbeiten;1,,Manuelles Fahren,,Ja,Nur Manuell verfügbar,,Systemgrenze,,Nein,Nein,Nein,,Keine Ahnung was Systemgrenze sein soll,"Fragt, ob er selber schalten soll, Ja von mir, dann FAS Taste","Zögern; Unabhängige Lösung ohne Fehler Aber: Zögern, sehr bewusstes Handeln und volle Konzentration; 2",,Automatisiertes Fahren,,Nein,,,Ja,Ja,Nein,,,"Ist sich nicht sicher, ob die Änderung der Verfügbarkeit in der Fahrt oder der vorherigen war, deshalb von mir NEIN ausgewählt",Keine Probleme; Schnelles Verarbeiten;1,,Manuelles Fahren,,Ja,Nur Manuell verfügbar,,Sensorfehler,,Nein,Nein,Nein,,,FAS zum Übersteuern,"Zögern; Unabhängige Lösung ohne Fehler Aber: Zögern, sehr bewusstes Handeln und volle Konzentration; 2",,6,2,6,Stimme gar nicht zu - 1,Stimme voll zu - 5,2,Stimme voll zu - 5,Stimme gar nicht zu - 1,3,2,4,2,Stimme voll zu - 5,Stimme gar nicht zu - 1,Stimme voll zu - 5,Stimme voll zu - 5,6,7,4,1,2,3,6,6,2,3,6,2,5,6,5,6,2,3,2,6,3,5,4,3,2,4,Klare Farbgebung bei aktuell verwendeten Modus,"Wording nicht eindeutig, verwirrend (Systemgrenze???)
Zu wenig Hinweis auf Ausfall des Systems (evtl Farbe oder Piepton)","Design etwas verwirrend. Gerade beim Ausfall des Systems nicht klar. Deutlicher kommunizieren.
",,2,1,Sehr schöne Studie.
24,2020-09-15 12:08:53,46,de,1377939524,2020-09-15 10:10:20,2020-09-15 12:08:53,70,2020-09-15 00:00:00,EL,WA,31,73,Männlich,Mehrmals pro Woche,10.001 - 20.000 km,Nein,Ja,Farbschwach,2,Ja,Ja,Ja,Nein,Wöchentlich,Audi,Wöchentlich,Audi,Nie,Audi,,,Manuelles Fahren,,Nein,,,Nein,Nein,,,"Zögern; Unabhängige Lösung ohne Fehler Aber: Zögern, sehr bewusstes Handeln und volle Konzentration; 2",,Manuelles Fahren,,Ja,Automatisiert verfügbar,,Nein,Nein,,,Keine Probleme; Schnelles Verarbeiten;1,,Sonstiges,nicht sicher,Nein,,,N/A,N/A,Ja,Wusste nicht welcher knopf für was ist,,"1 mal FAS, sich nicht sicher welcher Modus er sich befindet, deswegen auch antworten zu Hände am Lenkrad und Email keine Antwort, keine Mode Awareness","Hilfe vom Experimenter; Mehrere Fehler Massive Fehler erfordern einen Neustart der Aufgabe, Hilfe des Experimentators erforderlich; 5",,Automatisiertes Fahren,,Nein,,,Ja,Ja,,Frage nach Verfügbarkeit bisschen zäh,"Zögern; Unabhängige Lösung ohne Fehler Aber: Zögern, sehr bewusstes Handeln und volle Konzentration; 2",,Assistiertes Fahren,,Nein,,,Ja,Nein,Ja,Wegen 2 mal FAS und deaktivieren,,"sehr vorsichtig in automatisierter Fahrt!, 2 mal FAS um in Assistiert zu kommen, ansagevon mir nochmal, dass er in Assitiert schalten soll nachdem er 1 mal FAS nur drückte, Zusätzlich nach falscher Antwort Erklärung Hände immer am Lenkrad bei Assistierter Fahrt, nimmt auch Hände weg, HOD kommt aber nicht",Massive Fehler; Ein oder mehrere Fehler Deutlich beeinträchtigter Operationsablauf Übermäßige Korrektur von Fehlern Keine Hilfe des Experimentators erforderlich; 4,,Assistiertes Fahren,,Ja,Automatisiert nicht mehr verfügbar,,Sensorfehler,,Nein,Nein,,,Keine Probleme; Schnelles Verarbeiten;1,,Assistiertes Fahren,,Nein,,,Nein,Nein,,,Keine Probleme; Schnelles Verarbeiten;1,,Assistiertes Fahren,,Ja,Automatisiert verfügbar,,Nein,Nein,,,Keine Probleme; Schnelles Verarbeiten;1,,Automatisiertes Fahren,,Nein,,,Ja,Ja,Nein,,,,"Zögern; Unabhängige Lösung ohne Fehler Aber: Zögern, sehr bewusstes Handeln und volle Konzentration; 2",,Manuelles Fahren,,Ja,Sonstiges,"nicht wahrgenommen, ob noch was verfügbar wäre",Systemgrenze,,Nein,Nein,Nein,,,"1 mal FAS, liest davor sehr genau, zögernd, weiß nicht ob noch was verfügbar wäre","Zögern; Unabhängige Lösung ohne Fehler Aber: Zögern, sehr bewusstes Handeln und volle Konzentration; 2",,Automatisiertes Fahren,,Ja,Automatisiert verfügbar,,Ja,Ja,Nein,,,,Keine Probleme; Schnelles Verarbeiten;1,,Manuelles Fahren,,Ja,Sonstiges,nichts wahrgenommen,Sonstiges,Systemfehler,Nein,Nein,Nein,,,"sieht Fehlermeldung, nimmt aber nur Hände ans Lenkrad, Notbremsung kommt, Ansage von mir zu bremsen, Frage nach Probleme bei Wechsel sinnlos weil Ansage von mir","Hilfe vom Experimenter; Mehrere Fehler Massive Fehler erfordern einen Neustart der Aufgabe, Hilfe des Experimentators erforderlich; 5",,5,2,6,2,4,Stimme gar nicht zu - 1,Stimme voll zu - 5,Stimme gar nicht zu - 1,4,Stimme gar nicht zu - 1,4,Stimme gar nicht zu - 1,Stimme voll zu - 5,2,3,4,6,6,4,1,2,4,7,6,2,3,6,1,7,4,6,6,2,4,2,6,1,6,2,2,4,6,einfache hinweise zur verfügbarkeit. ,,anordnung der systemhinweise sollte zentral im display liegen + akustiscche unterstützung wäre hilfreich,,2,3,mehr eindrücke durch verkehrsteilnehmer oder ähnliches
25,2020-09-15 14:15:36,46,de,1462329372,2020-09-15 12:46:59,2020-09-15 14:15:36,71,2020-09-15 00:00:00,GE,MA,24,31,Männlich,Mehrmals pro Monat,5.001 - 10.000 km,"Ja, ich nutze sie auch jetzt",Nein,,2,Ja,Ja,Ja,Nein,Mehrmals täglich,"Audi, BMW, VW",Monatlich,"Audi, BMW, VW",Monatlich,"Audi, BMW, VW",,,Manuelles Fahren,,Nein,,,Nein,Nein,,,Keine Probleme; Schnelles Verarbeiten;1,,Manuelles Fahren,,Ja,Automatisiert verfügbar,,Nein,Nein,,,Keine Probleme; Schnelles Verarbeiten;1,,Automatisiertes Fahren,,Nein,,,Ja,Ja,Nein,,,"fragt wegen SURT danach, spielt nämlich nicht, Erklärung von mir","Zögern; Unabhängige Lösung ohne Fehler Aber: Zögern, sehr bewusstes Handeln und volle Konzentration; 2",,Automatisiertes Fahren,,Nein,,,Ja,Ja,,,Keine Probleme; Schnelles Verarbeiten;1,,Assistiertes Fahren,,Nein,,,Nein,Nein,Nein,,,,Keine Probleme; Schnelles Verarbeiten;1,,Assistiertes Fahren,,Ja,Automatisiert nicht mehr verfügbar,,Sensorfehler,,Nein,Nein,,,Keine Probleme; Schnelles Verarbeiten;1,,Assistiertes Fahren,,Nein,,,Nein,Nein,,,Keine Probleme; Schnelles Verarbeiten;1,,Assistiertes Fahren,,Ja,Automatisiert verfügbar,,Nein,Nein,,,Keine Probleme; Schnelles Verarbeiten;1,,Automatisiertes Fahren,,Nein,,,Ja,Ja,Nein,,,,Keine Probleme; Schnelles Verarbeiten;1,,Manuelles Fahren,,Ja,Sonstiges,nicht wahrgenommen nach übersteuern,Systemgrenze,,Nein,Nein,Nein,,"Wusste nicht, dass explizite Aufforderung ist, Erklärt alle Fehlermeldungen","Liest Meldung handelt aber nicht, wusste nicht dass er handeln soll, weiß nichts wegen der Verfügbarkeit, Erklärt mir aber detailliert die Fehlermeldungen","Hilfe vom Experimenter; Mehrere Fehler Massive Fehler erfordern einen Neustart der Aufgabe, Hilfe des Experimentators erforderlich; 5",,Automatisiertes Fahren,,Nein,,,Ja,Ja,Nein,,,"nimmt Änderung der Verfügbarkeit nicht wahr, wie viele zuvor, vermutlich vergessen",Keine Probleme; Schnelles Verarbeiten;1,,Manuelles Fahren,,Ja,Alle verfügbar,,Sensorfehler,,Nein,Nein,Nein,,,"Bremst, ist aber sehr vorgewarnt, sagt bei Skala ist alles verfügbar auf Nachfrage","Zögern; Unabhängige Lösung ohne Fehler Aber: Zögern, sehr bewusstes Handeln und volle Konzentration; 2",,2,3,6,Stimme gar nicht zu - 1,4,Stimme gar nicht zu - 1,Stimme voll zu - 5,Stimme gar nicht zu - 1,Stimme voll zu - 5,Stimme gar nicht zu - 1,Stimme voll zu - 5,Stimme gar nicht zu - 1,2,Stimme gar nicht zu - 1,2,4,5,7,4,1,1,7,7,7,1,4,7,1,7,6,4,6,6,6,2,7,1,7,1,2,3,5,Einfach zu bedienen (zwei Tasten). Unterschiedliche farbliche Darstellung für die Fahrmodi finde ich gut.,Warnung für kritische Situationen ist nicht klar gegeben.,"Akustische Signale sind notwendig, um die Aufmerksamkeit des Fahrers auf das Kombi-Instrument zu ziehen.
Sensorfehler bzw. Ausfall eines Systems müssen farblich anders dargestellt werden => z.B. gelb für wichtige Hinweise und rot für kritische Systemfehler! Außerdem muss die ""kritische"" Information für den Fahrer zentraler und größer Im Display dargestellt werden, damit er es sofort versteht.

Andere Symbole für die Fahrmodi verwenden => z.B. Assistiertes Fahren mit Lenkradsymbol + Hände am Lenkrad, Automatisiertes Fahren mit einem Auto Symbol von oben + die Fahrspuren, damit der Fahrer weiß, dass das Auto selbstständig fährt.",sieh oben,1,1,Nein
26,2020-09-17 13:49:36,46,de,2139325011,2020-09-17 12:15:00,2020-09-17 13:49:36,72,2020-09-17 00:00:00,So,Se,18,25,Männlich,Täglich,5.001 - 10.000 km,"Ja, ich nutze sie auch jetzt",Nein,,Keine Kenntnisse - 0,N/A,N/A,N/A,Ja,,,,,,,,,Manuelles Fahren,,Nein,,,Nein,Nein,,,Keine Probleme; Schnelles Verarbeiten;1,,Manuelles Fahren,,Ja,Automatisiert verfügbar,,Nein,Nein,,,Keine Probleme; Schnelles Verarbeiten;1,,Automatisiertes Fahren,,Nein,,,Ja,Ja,Nein,,,,Keine Probleme; Schnelles Verarbeiten;1,,Automatisiertes Fahren,,Nein,,,Ja,Ja,,,Keine Probleme; Schnelles Verarbeiten;1,,Assistiertes Fahren,,Nein,,,Nein,Nein,Nein,,,,"Zögern; Unabhängige Lösung ohne Fehler Aber: Zögern, sehr bewusstes Handeln und volle Konzentration; 2",,Assistiertes Fahren,,Ja,Automatisiert nicht mehr verfügbar,,Sensorfehler,,Nein,Nein,,,Keine Probleme; Schnelles Verarbeiten;1,,Assistiertes Fahren,,Nein,,,Nein,Nein,,,Keine Probleme; Schnelles Verarbeiten;1,,Assistiertes Fahren,,Ja,Automatisiert verfügbar,,Nein,Nein,,,Keine Probleme; Schnelles Verarbeiten;1,,Automatisiertes Fahren,,Nein,,,Ja,Ja,Nein,,,,Keine Probleme; Schnelles Verarbeiten;1,,Manuelles Fahren,,Ja,Sonstiges,denkt alles noch verfügbar,Sonstiges,Fehlermeldung,Nein,Nein,Nein,,,FAS Taste,"Zögern; Unabhängige Lösung ohne Fehler Aber: Zögern, sehr bewusstes Handeln und volle Konzentration; 2",,Automatisiertes Fahren,,Ja,Automatisiert verfügbar,,Nein,Nein,Nein,,,"befindet sich nur in Assistiert, soll aber in Automatisiert, Antwort unterschiedlich auf Fragen","Kleinere Fehler; Unabhängige Lösung ohne oder mit kleineren Fehlern, die selbstbewusst korrigiert Aber: Längere Denkpausen Bewertung möglicher Arbeitsschritte; 3",,Manuelles Fahren,,Ja,Keines mehr verfügbar,,Sensorfehler,,Nein,Nein,Nein,,,FAS,Keine Probleme; Schnelles Verarbeiten;1,,4,Stimme gar nicht zu - 1,6,3,Stimme voll zu - 5,4,4,Stimme gar nicht zu - 1,3,3,Stimme voll zu - 5,2,2,2,4,2,6,6,4,1,3,3,3,2,2,2,3,2,6,6,6,5,4,2,3,6,5,3,2,2,2,5,"Übersichtlich, wenn Konzentration auf dem Kombidisplay lag",Zwang Kombidisplay im Auge zu behalten,Sound bei Fehlermeldung,,1,2,
